dataset,method,num_examples,question_id,question,expected_answer,response,selected_examples,correct,extracted_answer,tokens_prompt_tokens,tokens_completion_tokens,tokens_total_tokens,response_time,selection_time,total_latency,timestamp
combined,random,8,Mercury_7263848,"Auroras occur where Earth's magnetosphere traps high-energy particles in which region of the atmosphere?
A. troposphere
B. stratosphere
C. thermosphere
D. exosphere",C,"This question is about the phenomenon of auroras and the atmospheric region where they occur. Auroras are caused by interactions between solar wind particles and Earth's magnetosphere, leading to the emission of light in the thermosphere. The thermosphere is the region of the atmosphere where high-energy particles are trapped by Earth's magnetic field, resulting in the colorful light displays known as auroras. Therefore, the answer is C. thermosphere.
Answer: C","['commonsenseqa_train_3269', 'gsm8k_train_3981', 'commonsenseqa_train_1489', 'commonsenseqa_train_6912', 'commonsenseqa_train_1746', 'gsm8k_train_4211', 'AKDE&ED_2008_4_41', 'Mercury_SC_402161']",True,C,1217,89,1306,1.3271942138671875,2.193450927734375e-05,1.3272161483764648,2025-05-17T22:13:50.093736
combined,random,8,ACTAAP_2010_7_8,"The list below gives some symptoms of people with the common cold. Symptoms of the Common Cold stuffy nose low fever sore throat cough Which body system is most affected by the common cold?
A. Nervous
B. Digestive
C. Circulatory
D. Respiratory",D,"This question is about identifying the body system most affected by the common cold based on the symptoms provided. The symptoms listed, such as a stuffy nose, sore throat, and cough, are all related to the respiratory system. The respiratory system includes the nose, throat, and lungs, which are commonly affected by the common cold virus. Therefore, the answer is D. Respiratory.
Answer: D","['commonsenseqa_train_3853', 'commonsenseqa_train_3814', 'gsm8k_train_2779', 'commonsenseqa_train_6615', 'commonsenseqa_train_8900', 'commonsenseqa_train_152', 'gsm8k_train_5417', 'OHAT_2008_5_13']",True,D,1392,80,1472,1.4304871559143066,2.3126602172851562e-05,1.4305102825164795,2025-05-17T22:13:52.157162
combined,random,8,Mercury_7145583,"Elias investigates whether soaking beans in water before planting affects how the beans grow. Which beans would most likely be the control group?
A. the beans that were soaked the least amount of time
B. the beans that were not soaked in water
C. the beans that had the greatest mass
D. the beans that grew the tallest",B,"This question is about experimental design and control groups. In an experiment, the control group is the group that does not receive the experimental treatment. In this case, the experimental treatment is soaking beans in water before planting. Therefore, the control group would be the beans that were not soaked in water (option B) because they represent the baseline condition against which the soaked beans are compared. The other options do not represent the control group as they involve variations in soaking time, mass, or growth, which are not related to the experimental treatment. Therefore, the answer is B.
Answer: B","['Mercury_SC_405793', 'gsm8k_train_244', 'commonsenseqa_train_7350', 'Mercury_406888', 'Mercury_SC_415014', 'MCAS_2013_5_29398', 'gsm8k_train_6332', 'Mercury_7171990']",True,B,1159,117,1276,1.2575159072875977,2.193450927734375e-05,1.257537841796875,2025-05-17T22:13:54.010476
combined,random,8,NYSEDREGENTS_2015_4_16,"Which tool should a student use to examine spots on a frog?
A. thermometer
B. hand lens
C. graduated cylinder
D. magnet",B,"This question is about selecting the appropriate tool for examining spots on a frog. A thermometer is used to measure temperature, a graduated cylinder is used to measure volume, and a magnet is used to attract magnetic materials. A hand lens, on the other hand, is a magnifying glass that can be used to closely examine small details, such as spots on a frog. Therefore, the answer is B. hand lens.
Answer: B. hand lens","['Mercury_7032550', 'Mercury_SC_402158', 'commonsenseqa_train_1588', 'commonsenseqa_train_5168', 'commonsenseqa_train_3872', 'commonsenseqa_train_2504', 'Mercury_7171990', 'gsm8k_train_2370']",True,B,1209,89,1298,1.1347870826721191,2.288818359375e-05,1.134809970855713,2025-05-17T22:13:55.763746
combined,random,8,CSZ20334,"Gravity is responsible for the ___.
A. orbits of the planets around the Sun
B. rotation of a planet on its axis
C. tilt of Earth's axis
D. phases of the Moon",A,"This question is about the effects of gravity in the solar system. Gravity is the force that governs the motion of celestial bodies like planets and moons. It is responsible for keeping planets in orbit around the Sun, which is described by Kepler's laws of planetary motion. Therefore, the answer is A. orbits of the planets around the Sun.
Answer: A","['gsm8k_train_653', 'commonsenseqa_train_8727', 'commonsenseqa_train_4349', 'commonsenseqa_train_4272', 'Mercury_SC_407568', 'commonsenseqa_train_5794', 'Mercury_7015873', 'commonsenseqa_train_2662']",True,A,1057,71,1128,1.132925271987915,2.4080276489257812e-05,1.1329493522644043,2025-05-17T22:13:57.532079
combined,random,8,MCAS_1998_8_22,"A plant scientist is developing a new fertilizer called Hypergrow. She designs an experiment to test whether Hypergrow helps plants grow faster than Supergrow, a fertilizer already on the market. Which of the following should the scientist do with light during the experiment?
A. Apply the same amount of light to all the plants.
B. Apply only green light to all the plants.
C. Flash the lights to simulate a partly cloudy day.
D. Keep the plants in darkness.",A,"This question is about the role of light in plant growth experiments. Light is essential for photosynthesis, a process that plants use to produce energy for growth. To ensure a fair comparison between Hypergrow and Supergrow, the scientist should control all variables except for the type of fertilizer used. Therefore, the scientist should apply the same amount of light to all the plants (option A) to eliminate light as a variable that could affect the results of the experiment.
Answer: A. Apply the same amount of light to all the plants.","['gsm8k_train_792', 'gsm8k_train_1307', 'Mercury_7072415', 'commonsenseqa_train_3997', 'commonsenseqa_train_5000', 'gsm8k_train_1973', 'NYSEDREGENTS_2007_8_21', 'commonsenseqa_train_5378']",True,A,1362,107,1469,1.406172752380371,2.288818359375e-05,1.4061956405639648,2025-05-17T22:13:59.582133
combined,random,8,Mercury_7210455,"In which way is any single observation of wind speed best described?
A. It is an indication of a future weather condition.
B. It is an indication of the amount of humidity.
C. It is an indication of weather at a specific time.
D. It is an indication of the existing climate.",C,"This question is about the nature of a single observation of wind speed. Wind speed is a measure of the rate at which air is moving past a certain point at a specific time. Therefore, it is best described as an indication of weather at a specific time, as it reflects the current atmospheric conditions related to wind movement. Options A, B, and D are not accurate because wind speed alone does not predict future weather conditions, humidity levels, or the overall climate. Therefore, the answer is C.
Answer: C","['commonsenseqa_train_9295', 'Mercury_SC_406744', 'gsm8k_train_772', 'gsm8k_train_5369', 'commonsenseqa_train_3116', 'gsm8k_train_712', 'Mercury_7211663', 'commonsenseqa_train_7350']",True,C,1390,103,1493,1.2557621002197266,2.6941299438476562e-05,1.255789041519165,2025-05-17T22:14:01.434471
combined,random,8,Mercury_415081,"In a rubber duck race, the winning duck traveled 300 meters in 10 minutes. What was the duck's average speed?
A. 0.5 m/s
B. 1.0 m/s
C. 7.5 m/s
D. 30 m/s",A,"To find the average speed, we use the formula: Average Speed = Total Distance / Total Time.

Given that the winning duck traveled 300 meters in 10 minutes:
Average Speed = 300 meters / 10 minutes = 30 meters per minute.

To convert this to meters per second (m/s), we know that 1 minute is equal to 60 seconds:
30 meters per minute = 30 meters / 60 seconds = 0.5 meters per second.

Therefore, the duck's average speed was 0.5 m/s.
Answer: A. 0.5 m/s","['CSZ10245', 'Mercury_7124163', 'commonsenseqa_train_6267', 'gsm8k_train_3978', 'commonsenseqa_train_9324', 'Mercury_7084000', 'Mercury_SC_407066', 'commonsenseqa_train_1312']",True,A,1186,121,1307,2.342373847961426,3.62396240234375e-05,2.342410087585449,2025-05-17T22:14:04.535935
combined,random,8,Mercury_7008260,"Which is a possible consequence of global warming?
A. an increase in the amount of coral reefs
B. a decrease in temperature, causing earlier frosts
C. an increase in the number of heat waves, causing droughts
D. a decrease in temperature, causing shorter growing seasons",C,"This question is about understanding the impacts of global warming on the environment. Global warming is associated with rising temperatures due to increased greenhouse gas emissions. One of the consequences of global warming is an increase in the number and intensity of heatwaves, leading to droughts. Heatwaves are a direct result of higher temperatures caused by global warming. Therefore, the most likely consequence of global warming among the options provided is an increase in the number of heatwaves, causing droughts. The answer is C. an increase in the number of heat waves, causing droughts.
Answer: C. an increase in the number of heat waves, causing droughts","['Mercury_7206360', 'Mercury_416594', 'commonsenseqa_train_2041', 'commonsenseqa_train_6211', 'gsm8k_train_4729', 'Mercury_7166618', 'gsm8k_train_7417', 'gsm8k_train_898']",True,C,1404,127,1531,1.4165928363800049,2.09808349609375e-05,1.4166138172149658,2025-05-17T22:14:06.525368
combined,random,8,Mercury_7137130,"The loudness of sound can be changed by
A. decreasing the pitch.
B. increasing the frequency.
C. increasing the amplitude.
D. decreasing the wavelength.",C,"This question is about the factors that affect the loudness of sound. Loudness is primarily determined by the amplitude of the sound wave, which corresponds to the intensity or energy of the wave. Increasing the amplitude of a sound wave increases its loudness, while decreasing the amplitude decreases the loudness. Therefore, the answer is C. increasing the amplitude.
Answer: C. increasing the amplitude","['Mercury_SC_400053', 'MCAS_2005_8_28', 'commonsenseqa_train_3527', 'gsm8k_train_4720', 'gsm8k_train_7076', 'Mercury_SC_415410', 'CSZ_2008_5_CSZ20111', 'commonsenseqa_train_1188']",True,C,1457,77,1534,1.5927989482879639,2.4080276489257812e-05,1.5928230285644531,2025-05-17T22:14:08.752386
combined,random,8,NYSEDREGENTS_2015_8_19,"Which type of organism converts wastes and dead materials into nutrients that can be used by plants?
1. carnivore
2. herbivore
3. decomposer
4. producer",3,"This question is about the role of organisms in nutrient cycling. Decomposers are organisms that break down dead materials and wastes into nutrients that can be used by plants. Carnivores and herbivores consume other organisms for energy, while producers create their own food through photosynthesis. Since the question specifically mentions converting wastes and dead materials into nutrients for plants, the correct answer is 3. decomposer.
Answer: 3. decomposer","['commonsenseqa_train_6049', 'NAEP_2011_8_S11+15', 'gsm8k_train_6619', 'CSZ_2008_5_CSZ20249', 'commonsenseqa_train_2591', 'ACTAAP_2008_7_8', 'gsm8k_train_159', 'gsm8k_train_5385']",True,C,1232,88,1320,1.8912739753723145,2.288818359375e-05,1.8912968635559082,2025-05-17T22:14:11.228652
combined,random,8,Mercury_404609,"Which feature of Great Basin National Park provides the best evidence that glaciers have moved over the landscape?
A. mud flats
B. shallow salt lakes
C. fields of sagebrush
D. piles of rocky debris",D,"This question is about identifying evidence of glacial movement in a national park. Glaciers leave behind distinct features as they move over the landscape, such as piles of rocky debris known as moraines. These rocky debris piles are created as glaciers transport and deposit rocks and sediment as they move. Therefore, the answer is D. piles of rocky debris.
Answer: D. piles of rocky debris","['Mercury_SC_413305', 'gsm8k_train_594', 'commonsenseqa_train_7744', 'gsm8k_train_6427', 'commonsenseqa_train_6054', 'Mercury_SC_401281', 'MDSA_2011_5_43', 'gsm8k_train_3462']",True,D,1242,78,1320,1.4617669582366943,2.3126602172851562e-05,1.4617900848388672,2025-05-17T22:14:13.287451
combined,random,8,Mercury_401014,"When a mixture of oxygen and hydrogen is ignited in a test tube, the reaction shown occurs. Hydrogen + Oxygen -> Water + Energy What happens to the total mass of the contents of the test tube?
A. The total mass increases.
B. The total mass decreases.
C. The total mass remains the same.
D. Part of the mass is changed to heat energy.",C,"This question is about the conservation of mass in a chemical reaction. In a closed system, the total mass of the reactants should be equal to the total mass of the products. In this reaction, hydrogen and oxygen combine to form water and release energy. The mass of the water and energy produced is equal to the mass of the hydrogen and oxygen consumed. Therefore, the total mass remains the same. The answer is C.
Answer: C","['commonsenseqa_train_9333', 'gsm8k_train_3981', 'gsm8k_train_3285', 'commonsenseqa_train_7491', 'Mercury_7230195', 'commonsenseqa_train_4700', 'commonsenseqa_train_6691', 'Mercury_7107258']",True,C,1305,88,1393,1.1200101375579834,2.3126602172851562e-05,1.1200332641601562,2025-05-17T22:14:15.039379
combined,random,8,MSA_2015_5_44,"Maryland has many renewable and nonrenewable natural resources. Which group contains only renewable resources found in Maryland?
A. wind, oil, coal
B. fish, coal, wind
C. oil, water, trees
D. trees, water, fish",D,"This question is about identifying renewable resources in Maryland. First, renewable resources are those that can be replenished naturally over time. Second, wind, water, trees, and fish are examples of renewable resources. Third, among the options provided, only option D contains a group of renewable resources found in Maryland, which are trees, water, and fish. Therefore, the answer is D. trees, water, fish.
Answer: D. trees, water, fish","['commonsenseqa_train_2647', 'commonsenseqa_train_8518', 'commonsenseqa_train_1545', 'NYSEDREGENTS_2007_4_16', 'commonsenseqa_train_5038', 'commonsenseqa_train_3997', 'Mercury_7200848', 'gsm8k_train_1463']",True,D,1320,92,1412,1.1227819919586182,2.288818359375e-05,1.122804880142212,2025-05-17T22:14:16.793071
combined,random,8,MCAS_2012_5_23619,"Which of the following processes makes it possible for plants to use energy from sunlight to produce their own food?
A. metamorphosis
B. photosynthesis
C. pollination
D. reproduction",B,"This question is about the process by which plants convert sunlight into energy to produce food. Photosynthesis is the process by which plants use sunlight, water, and carbon dioxide to create glucose (food) and oxygen. Metamorphosis, pollination, and reproduction are all important processes in the life cycle of plants, but they do not directly involve the conversion of sunlight into food. Therefore, the answer is B. photosynthesis.
Answer: B","['Mercury_178903', 'Mercury_7207393', 'gsm8k_train_898', 'commonsenseqa_train_1684', 'commonsenseqa_train_6065', 'gsm8k_train_7054', 'commonsenseqa_train_6932', 'Mercury_416384']",True,B,1315,89,1404,1.3695261478424072,2.6226043701171875e-05,1.3695523738861084,2025-05-17T22:14:18.720584
combined,random,8,Mercury_SC_401620,"Which event occurs once per day?
A. The Moon rises.
B. The new Moon occurs.
C. The Moon cycles through its phases.
D. The Moon passes in front of the Sun.",A,"This question is about the timing of lunar events. The Moon rises and sets every day due to the Earth's rotation, making option A correct. The new Moon occurs approximately once a month, not daily, so option B is incorrect. The Moon cycles through its phases over the course of a month, not daily, making option C incorrect. The Moon passing in front of the Sun is a solar eclipse, which occurs less frequently and not daily, so option D is incorrect. Therefore, the answer is A. The Moon rises.
Answer: A. The Moon rises.","['gsm8k_train_1629', 'MCAS_2004_9_12', 'commonsenseqa_train_3644', 'gsm8k_train_2006', 'Mercury_7042823', 'Mercury_SC_413305', 'commonsenseqa_train_7433', 'commonsenseqa_train_488']",True,A,1197,114,1311,1.4247629642486572,2.4080276489257812e-05,1.4247870445251465,2025-05-17T22:14:20.710863
combined,random,8,MDSA_2009_8_25,"A growing community relies on a nearby lake to provide fresh water for drinking and bathing. An increase in the use of fresh water will cause the lake to become
A. colder
B. deeper
C. larger
D. smaller",D,"This question is about the impact of increased water usage on a lake. When more water is drawn from a lake, it reduces the overall volume of water in the lake, which can lead to a decrease in the lake's size. Therefore, the answer is D. smaller. 
Answer: D. smaller","['commonsenseqa_train_4563', 'gsm8k_train_3981', 'gsm8k_train_4785', 'gsm8k_train_5234', 'MCAS_2013_5_29401', 'gsm8k_train_4375', 'gsm8k_train_1667', 'commonsenseqa_train_5147']",True,D,1239,61,1300,1.0051140785217285,2.09808349609375e-05,1.0051350593566895,2025-05-17T22:14:22.347928
combined,random,8,Mercury_400347,"A 20-N force acts on a 5-kg object at rest. How fast will the object accelerate on a frictionless surface?
A. 4 m/s^2
B. 15 m/s^2
C. 25 m/s^2
D. 100 m/s^2",A,"To find the acceleration of the object, we can use Newton's second law of motion, which states that force equals mass times acceleration (F = ma). 

Given:
Force (F) = 20 N
Mass (m) = 5 kg

Plugging in the values:
20 N = 5 kg * a

Solving for acceleration (a):
a = 20 N / 5 kg
a = 4 m/s^2

Therefore, the object will accelerate at 4 m/s^2 on a frictionless surface.
Answer: A. 4 m/s^2","['Mercury_7093170', 'commonsenseqa_train_964', 'commonsenseqa_train_1679', 'commonsenseqa_train_4065', 'gsm8k_train_1273', 'commonsenseqa_train_2584', 'gsm8k_train_6630', 'Mercury_SC_400039']",True,A,1267,122,1389,1.4539391994476318,2.5272369384765625e-05,1.4539644718170166,2025-05-17T22:14:24.421670
combined,random,8,Mercury_402102,"The Moon is in orbit around Earth. What keeps the Moon from changing its orbit?
A. friction
B. gravity
C. weight
D. rotation",B,"This question is about the forces that affect the Moon's orbit around Earth. Friction is a force that opposes motion and is not a significant factor in space where there is a vacuum. Weight is a measure of the force of gravity acting on an object, but it does not directly affect the Moon's orbit. Rotation refers to the spinning of an object around its axis and does not impact the Moon's orbit stability. Gravity is the force of attraction between two objects with mass, and it is what keeps the Moon in orbit around Earth without changing its path significantly. Therefore, the answer is B. gravity.
Answer: B","['TIMSS_2003_4_pg27', 'commonsenseqa_train_1612', 'commonsenseqa_train_3872', 'gsm8k_train_982', 'commonsenseqa_train_4533', 'commonsenseqa_train_9740', 'commonsenseqa_train_8935', 'Mercury_SC_413130']",True,B,1133,124,1257,1.2982158660888672,2.193450927734375e-05,1.2982378005981445,2025-05-17T22:14:26.379264
combined,random,8,MCAS_2004_5_16,"Jonas needs to split a log. He has a sledge hammer. What other tool should he also use to split the log?
A. a lever
B. a pulley
C. a wedge
D. a fulcrum",C,"This question is about the tools needed to split a log. A sledgehammer is used to deliver force to the log, but to actually split the log, a wedge is needed. A wedge is a simple machine that can be driven into the log to create a split. A lever, pulley, and fulcrum are not typically used for splitting logs. Therefore, the answer is C. a wedge.
Answer: C. a wedge","['Mercury_7284060', 'commonsenseqa_train_5862', 'gsm8k_train_410', 'Mercury_7041615', 'gsm8k_train_819', 'NYSEDREGENTS_2009_8_12', 'commonsenseqa_train_8308', 'commonsenseqa_train_634']",True,C,1458,89,1547,1.3220560550689697,2.2649765014648438e-05,1.3220787048339844,2025-05-17T22:14:28.289541
combined,random,8,Mercury_7200200,"Elizabeth uses a specific type of whistle to call her dogs. The noise made by the whistle is heard by the dogs but cannot be heard by the human ear. Which statement best describes why humans cannot hear the sound made by the whistle?
A. The speed of the sound is too fast.
B. The amplitude of the sound is too low.
C. The frequency of the sound is too high.
D. The wavelength of the sound is too long.",C,"This question is about the properties of sound waves. Humans can hear sounds within a specific range of frequencies, typically between 20 Hz to 20,000 Hz. If the frequency of the sound made by the whistle is too high, outside the range of human hearing, then humans would not be able to hear it. Therefore, the best statement that describes why humans cannot hear the sound made by the whistle is C. The frequency of the sound is too high.
Answer: C. The frequency of the sound is too high.","['NYSEDREGENTS_2009_8_5', 'gsm8k_train_671', 'Mercury_404686', 'gsm8k_train_916', 'commonsenseqa_train_7239', 'Mercury_7268188', 'gsm8k_train_2278', 'gsm8k_train_4160']",True,C,1363,106,1469,1.353701114654541,2.193450927734375e-05,1.3537230491638184,2025-05-17T22:14:30.263068
combined,random,8,Mercury_400828,"If an ion has three more electrons than protons, it has a
A. mass of +3.
B. mass of -3.
C. charge of +3.
D. charge of -3.",D,"This question is about the charge of an ion based on the number of electrons and protons. If an ion has three more electrons than protons, it will have a net negative charge because electrons are negatively charged particles. Since there are three more electrons than protons, the ion will have a charge of -3. Therefore, the answer is D.
Answer: D","['commonsenseqa_train_821', 'commonsenseqa_train_3119', 'gsm8k_train_1072', 'Mercury_7239348', 'gsm8k_train_4720', 'commonsenseqa_train_3853', 'MCAS_1999_8_22', 'Mercury_7184660']",True,D,1327,74,1401,1.1942329406738281,2.2172927856445312e-05,1.1942551136016846,2025-05-17T22:14:32.090401
combined,random,8,MCAS_2003_8_11,"Copper is an element that is used in electrical wires. What is the smallest unit of copper that still maintains the characteristics of copper?
A. the atom
B. the electron
C. the nucleus
D. the proton",A,"This question is about the fundamental building blocks of copper. Copper is an element, which means it is composed of atoms. The smallest unit of copper that still maintains the characteristics of copper is the atom, as it contains the unique properties of copper, such as its atomic number and chemical behavior. Electrons, protons, and nuclei are subatomic particles that make up an atom but do not individually represent copper as a whole. Therefore, the answer is A. 
Answer: A","['VASoL_2009_3_3', 'Mercury_7068618', 'Mercury_SC_401772', 'Mercury_7210175', 'commonsenseqa_train_1535', 'NAEP_2000_4_S21+7', 'gsm8k_train_5122', 'gsm8k_train_2277']",True,A,1120,96,1216,2.1757869720458984,2.5987625122070312e-05,2.1758129596710205,2025-05-17T22:14:34.832602
combined,random,8,Mercury_7170853,"The life cycle of a star includes formation, life, and death. In the Universe, where do new stars originate?
A. from fusion in red giants
B. in molecular clouds of gas
C. in radiation from black holes
D. from large fragments of antimatter",B,"This question is about the origin of new stars in the Universe. Stars are born from the gravitational collapse of dense regions within molecular clouds of gas and dust. Fusion in red giants occurs later in the life cycle of stars, not during their formation. Radiation from black holes and large fragments of antimatter are not known to be sources of star formation. Therefore, the answer is B. in molecular clouds of gas
Answer: B. in molecular clouds of gas","['commonsenseqa_train_1146', 'gsm8k_train_479', 'commonsenseqa_train_1588', 'commonsenseqa_train_7668', 'Mercury_409399', 'commonsenseqa_train_8666', 'gsm8k_train_1338', 'Mercury_406772']",True,B,1410,91,1501,1.1272568702697754,2.4080276489257812e-05,1.1272809505462646,2025-05-17T22:14:36.583577
combined,random,8,Mercury_404614,"Which is considered a property of soil?
A. streak
B. fracture
C. texture
D. luster",C,"This question is about properties of soil. Streak, fracture, and luster are properties used to describe minerals, not soil. Texture, on the other hand, refers to the relative proportions of sand, silt, and clay in soil, which is a key characteristic used to classify soil types. Therefore, the answer is C. texture. 
Answer: C. texture","['gsm8k_train_5706', 'commonsenseqa_train_9431', 'Mercury_7032813', 'LEAP__7_10350', 'gsm8k_train_6985', 'commonsenseqa_train_7973', 'gsm8k_train_5250', 'gsm8k_train_5543']",True,C,1410,75,1485,1.0837950706481934,2.3126602172851562e-05,1.0838181972503662,2025-05-17T22:14:38.277606
combined,random,8,Mercury_7084245,"Heart disease can result in a reduced amount of oxygen moving properly through the body. Which body system does heart disease most directly affect?
A. skeletal
B. excretory
C. circulatory
D. nervous",C,"This question is about the impact of heart disease on the body. Heart disease affects the heart, which is part of the circulatory system responsible for pumping blood and oxygen throughout the body. Therefore, the answer is C. circulatory.
Answer: C. circulatory","['gsm8k_train_5915', 'gsm8k_train_3981', 'gsm8k_train_7146', 'commonsenseqa_train_1827', 'commonsenseqa_train_3644', 'gsm8k_train_3268', 'commonsenseqa_train_1188', 'Mercury_7168683']",True,C,1373,53,1426,0.8772220611572266,2.1696090698242188e-05,0.8772437572479248,2025-05-17T22:14:39.727614
