dataset,method,num_examples,question_id,question,expected_answer,response,selected_examples,correct,extracted_answer,tokens_prompt_tokens,tokens_completion_tokens,tokens_total_tokens,response_time,selection_time,total_latency,timestamp
combined,random,4,Mercury_406550,"Tapeworms live in the intestines of dogs and absorb nutrients from food the dog eats. Which best describes the outcome of this relationship?
A. The dog and tapeworm both become ill.
B. The dog becomes ill, and the tapeworm benefits.
C. The tapeworm and dog help each other survive.
D. The tapeworm helps the dog survive.",B,"This question is about the relationship between tapeworms and dogs in terms of nutrient absorption. Tapeworms benefit from living in the intestines of dogs by absorbing nutrients from the food the dog eats. This relationship is parasitic, where one organism benefits (tapeworm) at the expense of the other (dog). Therefore, the best description of the outcome of this relationship is B. The dog becomes ill, and the tapeworm benefits.
Answer: B.","['commonsenseqa_train_3441', 'commonsenseqa_train_8834', 'gsm8k_train_569', 'Mercury_403701']",True,B,670,96,766,1.5265750885009766,1.7881393432617188e-05,1.5265929698944092,2025-05-17T22:03:02.323131
combined,random,4,Mercury_SC_402122,"Which of the following is a function of the digestive system of the human body?
A. carrying oxygen to the lungs
B. sending signals from the brain to the spinal cord
C. breaking down food into nutrients
D. providing support for the body",C,"This question is about the functions of the digestive system. The digestive system is responsible for breaking down food into nutrients that can be absorbed by the body. Carrying oxygen to the lungs is a function of the respiratory system, sending signals from the brain to the spinal cord is a function of the nervous system, and providing support for the body is a function of the skeletal system. Therefore, the answer is C.
Answer: C","['gsm8k_train_2553', 'commonsenseqa_train_3608', 'Mercury_7084648', 'Mercury_7132003']",True,C,639,85,724,1.1164941787719727,1.7881393432617188e-05,1.1165120601654053,2025-05-17T22:03:04.074673
combined,random,4,NYSEDREGENTS_2012_4_5,"Which terms are both used to describe the weather?
A. gravity and wind direction
B. precipitation and runoff
C. groundwater and erosion
D. air temperature and wind speed",D,"This question is about identifying terms related to weather. Gravity is a force, not a weather term, and wind direction is a specific aspect of wind behavior. Precipitation refers to any form of water, liquid or solid, falling from the atmosphere, while runoff is the movement of water over the land surface. Groundwater is water stored beneath the Earth's surface and erosion is the process of wearing away soil and rock. Air temperature and wind speed are both directly related to weather conditions, as temperature affects the overall climate and wind speed influences weather patterns. Therefore, the answer is D. air temperature and wind speed
Answer: D.","['commonsenseqa_train_2621', 'gsm8k_train_7056', 'commonsenseqa_train_1889', 'Mercury_SC_402285']",True,D,738,127,865,1.555239200592041,1.7881393432617188e-05,1.5552570819854736,2025-05-17T22:03:06.260975
combined,random,4,Mercury_7142748,"When heat flows from a hot spot to a cooler spot, entropy increases. When heat is forced to flow from a cool spot to a warmer spot, entropy decreases. Marta is looking for something in her house that causes a decrease in entropy. Which of these should she choose?
A. an ice cube melting
B. the refrigerator
C. an egg frying
D. the toaster",B,"An ice cube melting is a process where heat flows from a hot spot (the surroundings) to a cooler spot (the ice cube), so entropy increases. The refrigerator is a device that removes heat from the inside to the outside, so it causes a decrease in entropy. An egg frying is a process where heat flows from a hot spot (the pan) to a cooler spot (the egg), so entropy increases. The toaster is a device that heats up bread, so it causes an increase in entropy. Therefore, Marta should choose B. the refrigerator as something in her house that causes a decrease in entropy.

Answer: B. the refrigerator","['gsm8k_train_5895', 'gsm8k_train_64', 'gsm8k_train_5584', 'gsm8k_train_4333']",True,B,734,129,863,1.7101099491119385,1.7881393432617188e-05,1.710127830505371,2025-05-17T22:03:08.610077
combined,random,4,Mercury_SC_408984,"In the 1600s a scientist named Anton van Leeuwenhoek worked toward improving microscopes and created his own lenses. With his microscopes, Leeuwenhoek discovered bacteria and muscle fibers. Which type of job benefited most from these discoveries?
A. glass making
B. astronomy
C. medicine
D. teaching",C,"This question is about the impact of Anton van Leeuwenhoek's discoveries on different fields. Leeuwenhoek's work with microscopes led to significant advancements in the field of microbiology, particularly in the discovery of bacteria. This directly benefits the field of medicine, as understanding bacteria and other microorganisms is crucial for diagnosing and treating diseases. Glass making, astronomy, and teaching are not directly related to the discoveries made by Leeuwenhoek. Therefore, the answer is C. medicine.
Answer: C. medicine","['commonsenseqa_train_3295', 'commonsenseqa_train_5038', 'commonsenseqa_train_2041', 'commonsenseqa_train_4010']",True,C,656,108,764,1.3175349235534668,1.6927719116210938e-05,1.317551851272583,2025-05-17T22:03:10.567919
combined,random,4,NYSEDREGENTS_2015_8_28,"All living and nonliving material is composed of
1. air
2. elements
3. water
4. soil",2,"This question is asking about the basic components of all living and nonliving material. Air, water, and soil are specific components that make up some living and nonliving materials, but elements are the fundamental building blocks of all matter. Therefore, the answer is 2. elements. 
Answer: 2. elements","['gsm8k_train_6378', 'gsm8k_train_4467', 'gsm8k_train_2757', 'commonsenseqa_train_4889']",True,B,866,63,929,1.3256762027740479,1.6927719116210938e-05,1.325693130493164,2025-05-17T22:03:12.526493
combined,random,4,WASL_2005_5_10,"Sheri went on a field trip with her class and saw a stream with floating garbage. How could this pollution affect humans?
A. There may not be enough drinking water.
B. There may not be enough water in the water cycle.
C. There may not be enough oxygen for humans to breathe.",A,"This question is about the potential impact of water pollution on humans. A stream with floating garbage can lead to contamination of the water, making it unsafe for drinking. This can result in a scarcity of clean drinking water, affecting human health. The presence of garbage in the water does not directly impact the water cycle or oxygen levels in the air. Therefore, the answer is A.
Answer: A","['gsm8k_train_1463', 'commonsenseqa_train_8320', 'TIMSS_2003_8_pg28', 'Mercury_SC_401210']",True,A,670,78,748,1.0951082706451416,1.811981201171875e-05,1.0951263904571533,2025-05-17T22:03:14.260694
combined,random,4,Mercury_7018393,"Sound travels as a
A. wave without a medium.
B. series of compressions only.
C. pattern of up and down vibrations.
D. pattern of compressions and rarefactions.",D,"This question is about the nature of sound waves. Sound waves are mechanical waves that require a medium to travel through, so option A is incorrect. Sound waves consist of compressions (areas of high pressure) and rarefactions (areas of low pressure), which create a pattern of alternating high and low pressure regions. Therefore, the correct answer is D. pattern of compressions and rarefactions.
Answer: D","['Mercury_7112718', 'commonsenseqa_train_4616', 'gsm8k_train_5574', 'Mercury_7171990']",True,D,631,83,714,1.3417699337005615,1.71661376953125e-05,1.3417870998382568,2025-05-17T22:03:16.242261
combined,random,4,NYSEDREGENTS_2015_4_19,"During which process do animals increase in size?
A. breathing
B. growing
C. shedding
D. repairing",B,"This question is about the natural growth process of animals. Breathing, shedding, and repairing are all essential functions for animals but do not directly lead to an increase in size. Growing is the specific process by which animals increase in size as they develop and mature. Therefore, the answer is B.
Answer: B","['NCEOGA_2013_5_8', 'gsm8k_train_2172', 'commonsenseqa_train_525', 'AKDE&ED_2008_4_41']",True,B,582,62,644,1.3784830570220947,1.9073486328125e-05,1.3785021305084229,2025-05-17T22:03:18.196615
combined,random,4,Mercury_7004795,"Which particles are responsible for the electric charge of an atom?
A. protons and neutrons
B. protons and electrons
C. neutrons and molecules
D. molecules and electrons",B,"This question is about the components of an atom that contribute to its electric charge. First, protons and electrons are subatomic particles found in an atom. Second, protons carry a positive charge, while electrons carry a negative charge. Third, the balance between the positive charge of protons and the negative charge of electrons determines the overall electric charge of an atom. Therefore, the answer is B. protons and electrons.
Answer: B. protons and electrons","['gsm8k_train_443', 'commonsenseqa_train_2414', 'CSZ_2006_5_CSZ10266', 'commonsenseqa_train_590']",True,B,673,93,766,1.841933250427246,1.71661376953125e-05,1.8419504165649414,2025-05-17T22:03:20.670566
combined,random,4,Mercury_SC_401838,"Which of these tools is most helpful to a scientist observing very small bacteria?
A. ruler
B. telescope
C. microscope
D. meter stick",C,"When observing very small bacteria, a scientist would need a tool that allows them to see objects at a microscopic level. A ruler, telescope, and meter stick are all tools used for measuring larger objects or distances, not for observing small bacteria. A microscope, on the other hand, is specifically designed for viewing objects at a very small scale, making it the most helpful tool for a scientist observing very small bacteria.
Answer: C. microscope","['gsm8k_train_5342', 'commonsenseqa_train_4562', 'gsm8k_train_982', 'commonsenseqa_train_6126']",True,C,655,87,742,1.196274995803833,1.811981201171875e-05,1.1962931156158447,2025-05-17T22:03:22.501352
combined,random,4,Mercury_SC_402623,"What happens to sugar when it is combined with water?
A. it separates
B. it dissolves
C. it floats to the top
D. it becomes warm",B,"This question is about the chemical reaction between sugar and water. First, when sugar is combined with water, it typically dissolves due to the water molecules breaking down the sugar crystals. Second, this dissolution process is a common occurrence when sugar is mixed with water, leading to a homogeneous solution. Third, options like separating, floating to the top, or becoming warm do not accurately describe what happens when sugar is combined with water. Therefore, the answer is B. it dissolves.
Answer: B. it dissolves","['commonsenseqa_train_7573', 'commonsenseqa_train_5279', 'gsm8k_train_792', 'commonsenseqa_train_8201']",True,B,702,103,805,1.5623350143432617,1.621246337890625e-05,1.5623512268066406,2025-05-17T22:03:24.694422
combined,random,4,MCAS_2010_5_13,"Which of the following must all plant and animal species do in order for each species to survive?
A. migrate
B. reproduce
C. make food
D. change color",B,"In order for a species to survive, they must reproduce to ensure the continuation of their population. Migration, making food, and changing color are not essential for the survival of a species. Therefore, the answer is B. reproduce.
Answer: B. reproduce","['commonsenseqa_train_9333', 'commonsenseqa_train_2103', 'commonsenseqa_train_3811', 'gsm8k_train_1559']",True,B,719,51,770,1.2599577903747559,1.71661376953125e-05,1.2599749565124512,2025-05-17T22:03:26.550370
combined,random,4,Mercury_402286,"Which characteristic do both the Moon and Earth share?
A. They both have rocky surfaces.
B. They both have active volcanoes.
C. They both have similar atmospheres.
D. They both have the same gravitational pull.",A,"The Moon and Earth both have rocky surfaces, so the characteristic they share is A. They both have rocky surfaces.
Answer: A","['VASoL_2009_5_31', 'gsm8k_train_6074', 'gsm8k_train_6488', 'gsm8k_train_5719']",True,A,735,26,761,0.8253850936889648,1.6927719116210938e-05,0.825402021408081,2025-05-17T22:03:27.990157
combined,random,4,Mercury_7241255,"Neurons respond to stimuli and transmit impulses to coordinate body functions. Which of these indicates the rapid change in the membrane potential when a neuron is stimulated?
A. action potential
B. resting potential
C. refractory period
D. threshold period",A,"This question is about the electrical activity of neurons in response to stimuli. When a neuron is stimulated, there is a rapid change in the membrane potential that results in the generation of an electrical signal called an action potential. The action potential is the rapid depolarization and repolarization of the neuron's membrane that allows for the transmission of signals along the neuron. Resting potential refers to the membrane potential when the neuron is not being stimulated, refractory period is the time after an action potential when the neuron cannot generate another action potential, and threshold period is the level of stimulation required to trigger an action potential. Therefore, the answer is A. action potential.
Answer: A. action potential","['VASoL_2009_3_13', 'commonsenseqa_train_7007', 'commonsenseqa_train_5464', 'commonsenseqa_train_3527']",True,A,616,138,754,2.2545337677001953,1.7881393432617188e-05,2.254551649093628,2025-05-17T22:03:30.836796
combined,random,4,Mercury_7263848,"Auroras occur where Earth's magnetosphere traps high-energy particles in which region of the atmosphere?
A. troposphere
B. stratosphere
C. thermosphere
D. exosphere",C,"Auroras occur in the thermosphere, which is the region of the atmosphere where Earth's magnetosphere traps high-energy particles. The thermosphere is the layer of the atmosphere that extends from about 80 km to 550 km above the Earth's surface. Therefore, the answer is C. thermosphere.
Answer: C. thermosphere","['TIMSS_2007_4_pg48', 'commonsenseqa_train_9543', 'commonsenseqa_train_1127', 'gsm8k_train_4002']",True,C,637,68,705,1.0635178089141846,1.811981201171875e-05,1.0635359287261963,2025-05-17T22:03:32.532022
combined,random,4,ACTAAP_2010_7_8,"The list below gives some symptoms of people with the common cold. Symptoms of the Common Cold stuffy nose low fever sore throat cough Which body system is most affected by the common cold?
A. Nervous
B. Digestive
C. Circulatory
D. Respiratory",D,"The common cold primarily affects the respiratory system, as indicated by symptoms such as a stuffy nose, sore throat, and cough. These symptoms are related to the upper respiratory tract, including the nose, throat, and lungs. Therefore, the correct answer is D. 
Answer: D","['gsm8k_train_4334', 'MCAS_2006_9_16', 'gsm8k_train_4418', 'Mercury_SC_401772']",True,D,786,57,843,1.0062768459320068,1.71661376953125e-05,1.0062940120697021,2025-05-17T22:03:34.171647
combined,random,4,Mercury_7145583,"Elias investigates whether soaking beans in water before planting affects how the beans grow. Which beans would most likely be the control group?
A. the beans that were soaked the least amount of time
B. the beans that were not soaked in water
C. the beans that had the greatest mass
D. the beans that grew the tallest",B,"The control group in an experiment is the group that does not receive the treatment being tested. In this case, the treatment being tested is soaking beans in water before planting. Therefore, the control group would be the beans that were not soaked in water, as they are the group that does not receive the treatment. Therefore, the answer is B.
Answer: B","['TIMSS_2007_4_pg39', 'Mercury_7032550', 'Mercury_7014368', 'gsm8k_train_6833']",True,B,573,72,645,1.057168960571289,4.410743713378906e-05,1.0572130680084229,2025-05-17T22:03:35.826733
combined,random,4,NYSEDREGENTS_2015_4_16,"Which tool should a student use to examine spots on a frog?
A. thermometer
B. hand lens
C. graduated cylinder
D. magnet",B,"To examine spots on a frog, a student should use a hand lens. A hand lens is a magnifying glass that allows for close inspection of small details, making it the most suitable tool for examining spots on a frog. Therefore, the answer is B.
Answer: B","['gsm8k_train_7308', 'gsm8k_train_1783', 'Mercury_7269028', 'Mercury_7239348']",True,B,592,55,647,1.2290186882019043,2.002716064453125e-05,1.2290387153625488,2025-05-17T22:03:37.677429
combined,random,4,CSZ20334,"Gravity is responsible for the ___.
A. orbits of the planets around the Sun
B. rotation of a planet on its axis
C. tilt of Earth's axis
D. phases of the Moon",A,"Gravity is the force that governs the motion of celestial bodies in space. It is responsible for keeping planets in orbit around the Sun (A), as well as the Moon in orbit around Earth. Gravity also affects the rotation of planets on their axes (B) and can cause the tilt of a planet's axis (C). However, gravity is not directly responsible for the phases of the Moon (D), which are caused by the relative positions of the Earth, Moon, and Sun. Therefore, the answer is A. orbits of the planets around the Sun
Answer: A","['gsm8k_train_794', 'commonsenseqa_train_6873', 'gsm8k_train_4508', 'Mercury_SC_413130']",True,A,654,115,769,1.4165940284729004,2.288818359375e-05,1.4166169166564941,2025-05-17T22:03:39.743031
combined,random,4,MCAS_1998_8_22,"A plant scientist is developing a new fertilizer called Hypergrow. She designs an experiment to test whether Hypergrow helps plants grow faster than Supergrow, a fertilizer already on the market. Which of the following should the scientist do with light during the experiment?
A. Apply the same amount of light to all the plants.
B. Apply only green light to all the plants.
C. Flash the lights to simulate a partly cloudy day.
D. Keep the plants in darkness.",A,"In order to conduct a fair experiment, the plant scientist should apply the same amount of light to all the plants. This ensures that any differences in plant growth can be attributed to the fertilizers being tested rather than variations in light exposure. Therefore, the answer is A. Apply the same amount of light to all the plants.
Answer: A. Apply the same amount of light to all the plants.","['Mercury_SC_401220', 'gsm8k_train_701', 'gsm8k_train_5140', 'commonsenseqa_train_1049']",True,A,604,80,684,1.2185161113739014,2.3126602172851562e-05,1.2185392379760742,2025-05-17T22:03:41.594823
combined,random,4,Mercury_7210455,"In which way is any single observation of wind speed best described?
A. It is an indication of a future weather condition.
B. It is an indication of the amount of humidity.
C. It is an indication of weather at a specific time.
D. It is an indication of the existing climate.",C,"This question is asking about the nature of a single observation of wind speed. Wind speed is a specific measurement that provides information about the current weather conditions at a particular moment in time. It does not necessarily indicate future weather conditions, humidity levels, or the overall climate. Therefore, the best description is that it is an indication of weather at a specific time.
Answer: C. It is an indication of weather at a specific time.","['gsm8k_train_4375', 'commonsenseqa_train_4333', 'commonsenseqa_train_1133', 'commonsenseqa_train_27']",True,C,605,86,691,1.3842580318450928,3.504753112792969e-05,1.3842930793762207,2025-05-17T22:03:43.573281
combined,random,4,Mercury_415081,"In a rubber duck race, the winning duck traveled 300 meters in 10 minutes. What was the duck's average speed?
A. 0.5 m/s
B. 1.0 m/s
C. 7.5 m/s
D. 30 m/s",A,"To find the average speed of the duck, we use the formula: Average Speed = Total Distance / Total Time.

In this case, the total distance traveled by the duck is 300 meters, and the total time taken is 10 minutes, which is equivalent to 600 seconds (10 minutes x 60 seconds).

Therefore, Average Speed = 300 meters / 600 seconds = 0.5 m/s.

So, the average speed of the winning duck in the rubber duck race was 0.5 m/s.

Answer: A. 0.5 m/s","['Mercury_180163', 'gsm8k_train_2171', 'commonsenseqa_train_520', 'commonsenseqa_train_406']",True,A,675,116,791,1.481050968170166,1.7881393432617188e-05,1.4810688495635986,2025-05-17T22:03:45.696764
combined,random,4,Mercury_7008260,"Which is a possible consequence of global warming?
A. an increase in the amount of coral reefs
B. a decrease in temperature, causing earlier frosts
C. an increase in the number of heat waves, causing droughts
D. a decrease in temperature, causing shorter growing seasons",C,"Global warming is known to cause changes in climate patterns, leading to various consequences. One of the possible consequences of global warming is an increase in the number of heat waves, which can lead to droughts due to increased evaporation and lack of precipitation. Therefore, the answer is C. an increase in the number of heat waves, causing droughts.
Answer: C. an increase in the number of heat waves, causing droughts","['commonsenseqa_train_3502', 'gsm8k_train_4144', 'gsm8k_train_5631', 'commonsenseqa_train_5409']",True,C,583,86,669,1.5995471477508545,2.4080276489257812e-05,1.5995712280273438,2025-05-17T22:03:47.879122
combined,random,4,Mercury_7137130,"The loudness of sound can be changed by
A. decreasing the pitch.
B. increasing the frequency.
C. increasing the amplitude.
D. decreasing the wavelength.",C,"This question is about the factors that affect the loudness of sound. The loudness of sound is determined by the amplitude of the sound wave. Increasing the amplitude of a sound wave increases its loudness, while decreasing the amplitude decreases the loudness. Therefore, the answer is C. increasing the amplitude.
Answer: C. increasing the amplitude","['Mercury_SC_LBS10908', 'commonsenseqa_train_6396', 'commonsenseqa_train_1743', 'MCAS_2006_9_16']",True,C,643,68,711,2.2002220153808594,3.314018249511719e-05,2.2002551555633545,2025-05-17T22:03:50.737747
combined,random,4,NYSEDREGENTS_2015_8_19,"Which type of organism converts wastes and dead materials into nutrients that can be used by plants?
1. carnivore
2. herbivore
3. decomposer
4. producer",3,"This question is about the role of organisms in ecosystems. First, carnivores and herbivores consume other organisms for energy and do not directly convert waste into nutrients for plants. Second, producers create their own food through photosynthesis and do not convert waste into nutrients. Third, decomposers, such as bacteria and fungi, break down dead materials and waste, releasing nutrients that can be used by plants. Therefore, the answer is 3. decomposer.
Answer: 3. decomposer","['commonsenseqa_train_7508', 'gsm8k_train_3976', 'gsm8k_train_1876', 'commonsenseqa_train_3262']",True,C,821,99,920,1.5965209007263184,2.8848648071289062e-05,1.5965497493743896,2025-05-17T22:03:52.935487
combined,random,4,Mercury_404609,"Which feature of Great Basin National Park provides the best evidence that glaciers have moved over the landscape?
A. mud flats
B. shallow salt lakes
C. fields of sagebrush
D. piles of rocky debris",D,"This question is asking for a feature that indicates the movement of glaciers over the landscape. Glaciers leave behind piles of rocky debris called moraines as they move, so the best evidence that glaciers have moved over the landscape would be piles of rocky debris. Therefore, the answer is D. piles of rocky debris.
Answer: D","['gsm8k_train_7248', 'commonsenseqa_train_6291', 'commonsenseqa_train_8099', 'Mercury_7213150']",True,D,612,66,678,0.9856817722320557,0.00018596649169921875,0.9858677387237549,2025-05-17T22:03:54.742604
combined,random,4,Mercury_401014,"When a mixture of oxygen and hydrogen is ignited in a test tube, the reaction shown occurs. Hydrogen + Oxygen -> Water + Energy What happens to the total mass of the contents of the test tube?
A. The total mass increases.
B. The total mass decreases.
C. The total mass remains the same.
D. Part of the mass is changed to heat energy.",C,"This question is about the law of conservation of mass, which states that mass cannot be created or destroyed in a chemical reaction, only rearranged. In this reaction, hydrogen and oxygen combine to form water and release energy. The total mass of the reactants (hydrogen and oxygen) is equal to the total mass of the products (water and energy) because no mass is lost or gained during the reaction. Therefore, the total mass remains the same. The correct answer is C. 
Answer: C","['Mercury_7097965', 'gsm8k_train_3241', 'Mercury_SC_405793', 'Mercury_SC_401210']",True,C,636,101,737,1.3363220691680908,1.9788742065429688e-05,1.3363418579101562,2025-05-17T22:03:56.705521
combined,random,4,MSA_2015_5_44,"Maryland has many renewable and nonrenewable natural resources. Which group contains only renewable resources found in Maryland?
A. wind, oil, coal
B. fish, coal, wind
C. oil, water, trees
D. trees, water, fish",D,"This question is about differentiating between renewable and nonrenewable natural resources. The first thought process is that renewable resources are those that can be replenished over time, while nonrenewable resources are finite and cannot be easily replaced. The second thought process is that wind, water, trees, and fish are examples of renewable resources, as they can be naturally replenished. The third thought process is that oil and coal are nonrenewable resources, as they are formed over millions of years and cannot be easily replaced. Therefore, the answer is D. trees, water, fish.
Answer: D. trees, water, fish","['TIMSS_1995_8_Q14', 'commonsenseqa_train_2579', 'MCAS_2008_8_5691', 'commonsenseqa_train_4905']",True,D,659,128,787,1.298274040222168,2.47955322265625e-05,1.2982988357543945,2025-05-17T22:03:58.631769
