dataset,method,num_examples,question_id,question,expected_answer,response,selected_examples,correct,extracted_answer,tokens_prompt_tokens,tokens_completion_tokens,tokens_total_tokens,response_time,selection_time,total_latency,timestamp
combined,mmr,5,MCAS_2014_8_19,"Which of the following statements best describes the process of natural selection in a population?
A. All individuals develop traits to match changes to their environment.
B. All individuals learn to adapt to specific changes that occur slowly in their environment.
C. Some individuals respond to their environment by mutating to make themselves more likely to survive.
D. Some individuals have genetic differences that make them more likely to survive and reproduce in their environment.",D,"This question is about natural selection. Natural selection is the process by which individuals with advantageous traits that help them survive and reproduce in their environment are more likely to pass on those traits to their offspring. Option D best describes this process as it highlights genetic differences that give certain individuals a survival advantage. Therefore, the answer is D.
Answer: D","['Mercury_7137673', 'Mercury_7011060', 'commonsenseqa_train_58', 'Mercury_7168648', 'NYSEDREGENTS_2006_8_37']",True,D,877,68,945,1.0862751007080078,0.006478071212768555,1.0927531719207764,2025-05-21T13:41:55.010883
combined,mmr,5,Mercury_7251720,"Which explains how the epithelium offers protection to land-dwelling vertebrates?
A. Epithelium provides a rigid shell to prevent punctures.
B. Epithelium has capillaries to resist iron deficiency.
C. Epithelium insulates the vertebrate from hypothermia.
D. Epithelium prevents dehydration in vertebrates.",D,"This question is about the function of epithelium in land-dwelling vertebrates. Epithelium acts as a protective barrier that covers the external surfaces of the body, including the skin. One of its primary functions is to prevent dehydration by forming a waterproof layer that reduces water loss. Therefore, the answer is D. Epithelium prevents dehydration in vertebrates.
Answer: D","['commonsenseqa_train_2296', 'Mercury_7084648', 'gsm8k_train_2808', 'Mercury_7042823', 'MCAS_2000_4_4']",True,D,870,79,949,1.2459022998809814,0.007019996643066406,1.2529222965240479,2025-05-21T13:41:57.005243
combined,mmr,5,NYSEDREGENTS_2013_8_12,"A cell's chromosomes contain
1. genes
2. chlorophyll
3. sperm
4. eggs",1,"This question is about the contents of a cell's chromosomes. Chromosomes are structures within cells that contain genetic information in the form of genes. Genes are segments of DNA that code for specific traits or functions. Chlorophyll is a pigment involved in photosynthesis and is not found in chromosomes. Sperm and eggs are reproductive cells that contain half the number of chromosomes found in somatic cells. Therefore, the correct answer is 1.
Answer: 1","['MCAS_2007_8_5183', 'NYSEDREGENTS_2014_8_12', 'TIMSS_2003_4_pg27', 'Mercury_7235655', 'MCAS_1998_8_2']",True,A,721,92,813,1.407407283782959,0.006120920181274414,1.4135282039642334,2025-05-21T13:41:59.180775
combined,mmr,5,Mercury_7017955,"The density of a material can be measured by using a
A. meter stick and test tubes.
B. beaker and stopwatch.
C. thermometer and computer probes.
D. balance and graduated cylinder.",D,"This question is about measuring density, which requires determining both mass and volume. A balance is used to measure mass, and a graduated cylinder is used to measure volume. Therefore, the correct answer is D. balance and graduated cylinder.
Answer: D. balance and graduated cylinder","['Mercury_7006178', 'gsm8k_train_1332', 'commonsenseqa_train_5794', 'Mercury_180163', 'commonsenseqa_train_6528']",True,D,719,54,773,1.056509017944336,0.006846189498901367,1.0633552074432373,2025-05-21T13:42:01.023241
combined,mmr,5,TIMSS_2003_8_pg80,"Which of the following organs in fish has the same function as the human lung?
A. kidney
B. heart
C. gill
D. skin",C,"This question is about the organ in fish that performs a similar function to the human lung. In fish, gills are responsible for extracting oxygen from water and removing carbon dioxide, similar to how human lungs extract oxygen from the air and remove carbon dioxide. Kidneys filter waste from the blood, the heart pumps blood, and the skin provides protection and regulates temperature, but none of these organs perform the same function as the human lung. Therefore, the answer is C. gill. 
Answer: C","['commonsenseqa_train_634', 'NYSEDREGENTS_2014_8_12', 'Mercury_7263113', 'commonsenseqa_train_8821', 'gsm8k_train_871']",True,C,732,100,832,1.2725441455841064,0.006716012954711914,1.2792601585388184,2025-05-21T13:42:03.071497
combined,mmr,5,ACTAAP_2013_7_15,"Which is an advantage of sexual reproduction in the survival of a population?
A. prevents mutation
B. maintains genetic diversity
C. reduces the number of genes
D. creates competition between siblings",B,"This question is about the benefits of sexual reproduction in populations. Sexual reproduction involves the combination of genetic material from two parents, leading to genetic diversity in offspring. This genetic diversity is advantageous for populations as it increases the chances of survival in changing environments. It allows for the potential for beneficial traits to be passed on and for populations to adapt to new conditions. Therefore, the answer is B.
Answer: B","['Mercury_7228095', 'gsm8k_train_4906', 'MCAS_2006_8_34', 'commonsenseqa_train_2591', 'Mercury_7235655']",True,B,729,80,809,1.2350761890411377,0.0063779354095458984,1.2414541244506836,2025-05-21T13:42:05.084494
combined,mmr,5,Mercury_SC_406040,"Dogs have some learned behaviors. Which is most likely a learned behavior in a dog?
A. sniffing to find food
B. panting when it feels hot
C. chasing a squirrel up a tree
D. barking when it wants to go outside",D,"This question is about identifying learned behaviors in dogs. First, sniffing to find food is an innate behavior that dogs are born with to locate food sources. Second, panting when feeling hot is a physiological response to regulate body temperature and is not learned. Third, chasing a squirrel up a tree is a natural instinct for many dogs to hunt prey. Fourth, barking when wanting to go outside is a learned behavior as dogs can associate barking with being let outside. Therefore, the most likely learned behavior in a dog is D. barking when it wants to go outside.
Answer: D. barking when it wants to go outside","['Mercury_SC_415347', 'Mercury_7084648', 'gsm8k_train_5201', 'Mercury_7196263', 'commonsenseqa_train_7350']",True,D,825,128,953,2.5783469676971436,0.006526947021484375,2.584873914718628,2025-05-21T13:42:08.284926
combined,mmr,5,MEA_2014_5_8,"Constellations are patterns of objects seen in the night sky from Earth. How are the objects in constellations like the Sun?
A. The objects are stars.
B. The objects are planets.
C. The objects are located in this solar system.
D. The objects heat the atmosphere of Earth.",A,"This question is about the nature of objects in constellations and their similarity to the Sun. The first scientific principle is that constellations are made up of stars, not planets or objects within our solar system. The second thought process is that stars are the most common objects in constellations, similar to the Sun being a star. The third thought process is that while the Sun heats the Earth's atmosphere, this is not a defining characteristic of objects in constellations. Therefore, the answer is A.
Answer: A. The objects are stars.","['MCAS_2008_5_5638', 'gsm8k_train_5088', 'MCAS_2000_4_3', 'Mercury_7144148', 'commonsenseqa_train_3006']",True,A,858,112,970,1.61946702003479,0.0061419010162353516,1.6256089210510254,2025-05-21T13:42:10.671081
combined,mmr,5,Mercury_7194268,"Stars form from nebulae of dust and gases. Depending on its properties, a star may become a red, yellow, white, or blue star. Which property determines this star type?
A. age
B. location
C. mass
D. shape",C,"This question is about the factors that determine the type of star a nebula will become. The key property that determines the type of star is its mass. The mass of a star determines its temperature, luminosity, and color, which in turn determine whether it will be a red, yellow, white, or blue star. Therefore, the answer is C.
Answer: C","['MEA_2013_5_3', 'gsm8k_train_3285', 'Mercury_7213080', 'Mercury_SC_400169', 'NYSEDREGENTS_2006_8_37']",True,C,821,75,896,1.1746280193328857,0.006123065948486328,1.180751085281372,2025-05-21T13:42:12.594873
combined,mmr,5,Mercury_SC_415473,"A young ocean animal has two parents. Each of the parents has eight arms. How many arms does the young animal most likely have?
A. 2
B. 4
C. 8
D. 16",C,"This question is about the inheritance of a specific trait, in this case, the number of arms in an ocean animal. If each parent has eight arms, it is likely that the young animal will inherit this trait from both parents, resulting in a total of 8 + 8 = 16 arms. Therefore, the answer is D.
Answer: D","['gsm8k_train_2334', 'AIMS_2009_4_9', 'commonsenseqa_train_1137', 'Mercury_SC_401594', 'Mercury_411450']",False,D,825,71,896,1.038801908493042,0.006270885467529297,1.0450727939605713,2025-05-21T13:42:14.219545
combined,mmr,5,Mercury_7033600,"Which tool will best help scientists understand relationships between oceans and climate changes?
A. a computer model
B. a weather balloon
C. a rain gauge
D. radar",A,"This question is about studying the complex interactions between oceans and climate changes. A computer model would be the best tool to help scientists understand these relationships because it can simulate and analyze the intricate processes and feedback mechanisms involved in ocean-atmosphere interactions. Computer models can incorporate data from various sources to create simulations that provide insights into how changes in ocean conditions can impact climate patterns and vice versa. Therefore, the answer is A.
Answer: A","['Mercury_7085190', 'gsm8k_train_1799', 'NYSEDREGENTS_2011_8_11', 'MCAS_2009_8_2', 'Mercury_7098140']",True,A,832,86,918,1.0354700088500977,0.006159067153930664,1.0416290760040283,2025-05-21T13:42:15.877309
combined,mmr,5,Mercury_7238945,"The ability to roll the tongue in humans is coded by the dominant allele R. The inability to roll the tongue is coded by the recessive allele r. A man with an RR allele combination for the trait produces a zygote with a woman with an rr allele combination for the trait. Which allele combination could occur in the zygote?
A. R
B. rr
C. Rr
D. RR",C,"This question is about basic Mendelian inheritance of dominant and recessive alleles. Since the man is homozygous dominant (RR), he can only contribute an R allele. The woman is homozygous recessive (rr), so she can only contribute an r allele. Therefore, the zygote can inherit an R allele from the man and an r allele from the woman, resulting in a heterozygous genotype of Rr. Therefore, the answer is C. Rr.
Answer: C. Rr","['Mercury_7238980', 'Mercury_SC_400165', 'Mercury_416594', 'commonsenseqa_train_727', 'gsm8k_train_1273']",True,C,1014,106,1120,1.1576318740844727,0.0062808990478515625,1.1639127731323242,2025-05-21T13:42:17.796777
combined,mmr,5,Mercury_7270130,"What are the properties of the Earth's crust and mantle that are most responsible for Earth's tectonic activity?
A. They are in different states and have different temperatures.
B. They are in the same state but have different temperatures.
C. They are in different states but have the same temperature.
D. They are the same state and have the same temperature.",A,"This question is about the Earth's tectonic activity and the properties of the crust and mantle that contribute to it. Tectonic activity, such as plate movement and earthquakes, is primarily driven by the differences in the physical properties of the Earth's crust and mantle. The crust is solid and relatively thin compared to the mantle, which is solid but capable of flowing over long periods of time. These differences in state and behavior, along with variations in temperature, create the conditions for tectonic activity. Therefore, the answer is A.
Answer: A","['Mercury_7222740', 'Mercury_7185448', 'Mercury_7236653', 'Mercury_7211120', 'Mercury_7084648']",True,A,860,111,971,1.6204557418823242,0.007819890975952148,1.6282756328582764,2025-05-21T13:42:20.176998
combined,mmr,5,Mercury_7004638,"A certain snake species in an ecosystem eats small rodents. If a bird species is introduced into the ecosystem that also eats small rodents, which of these will most likely increase?
A. parasitism
B. migration
C. mutualism
D. competition",D,"This question is about the potential impact of introducing a new predator into an ecosystem. When both the snake species and the bird species are consuming the same prey (small rodents), they will be competing for the same food resource. This competition for limited prey populations is likely to increase due to the introduction of the bird species, as both predators will need to consume more rodents to meet their dietary needs. Therefore, the relationship between the snake and the bird species can be classified as competition.
Answer: D. competition","['Mercury_7009625', 'commonsenseqa_train_27', 'Mercury_405468', 'Mercury_7241115', 'gsm8k_train_4729']",True,D,806,100,906,1.1018731594085693,0.00671696662902832,1.1085901260375977,2025-05-21T13:42:21.867695
combined,mmr,5,Mercury_407767,"Water at 20 degrees Celsius is placed on a stove. As the water is heated, thermal energy is absorbed by the water. If the water is heated to a maximum temperature of 80 degrees Celsius, what happens as a result of the increased temperature?
A. The potential energy increases.
B. The evaporation decreases.
C. The disorder decreases.
D. The entropy increases.",D,"This question is about the changes in thermal energy and entropy as water is heated. As the water is heated from 20 degrees Celsius to 80 degrees Celsius, the thermal energy of the water increases, leading to an increase in disorder or entropy. Entropy is a measure of the randomness or disorder in a system, and as the water molecules gain more thermal energy, they move more randomly, increasing the entropy of the system. Therefore, the answer is D.
Answer: D","['Mercury_SC_413300', 'Mercury_7099435', 'commonsenseqa_train_916', 'Mercury_7042683', 'Mercury_411730']",True,D,833,95,928,1.7470078468322754,0.006223917007446289,1.7532317638397217,2025-05-21T13:42:24.372467
combined,mmr,5,ACTAAP_2009_5_1,"Which planet is fourth from the Sun in our solar system?
A. Mars
B. Earth
C. Venus
D. Jupiter",A,"This question is about the order of planets in our solar system. Counting from the Sun outwards, the fourth planet is Mars. Therefore, the answer is A. Mars.
Answer: A. Mars","['Mercury_7100713', 'commonsenseqa_train_8821', 'commonsenseqa_train_6868', 'NYSEDREGENTS_2005_8_33', 'gsm8k_train_1022']",True,A,666,41,707,0.914945125579834,0.006038188934326172,0.9209833145141602,2025-05-21T13:42:25.906217
combined,mmr,5,NYSEDREGENTS_2010_8_39,"Compared to the particles in a hardened lava sample, the particles in a liquid lava sample
1. have a lower temperature
2. have less kinetic energy
3. are moving faster
4. are closer together",3,"This question is about the differences in particle behavior between solid and liquid lava samples. In a hardened lava sample, the particles are fixed in place and have less kinetic energy compared to particles in a liquid lava sample, which are moving more freely and have higher kinetic energy. Therefore, the correct statement is that the particles in a liquid lava sample are moving faster, so the answer is 3. 
Answer: 3","['Mercury_7004515', 'NYSEDREGENTS_2007_8_36', 'NYSEDREGENTS_2006_8_11', 'Mercury_7040740', 'MCAS_1998_8_2']",True,C,782,83,865,1.183868169784546,0.006221771240234375,1.1900899410247803,2025-05-21T13:42:27.684340
combined,mmr,5,Mercury_7005075,"Which of the following is a characteristic of the ""steady state theory"" of the universe?
A. The universe is constantly growing and changing.
B. A great explosion caused the origin of the universe.
C. The nature of the universe has always been the same.
D. Light moving from the center of the universe appears red.",C,"This question is about the steady state theory of the universe. The steady state theory posits that the nature of the universe has always been the same, meaning that it does not change over time. This theory contrasts with the Big Bang Theory, which suggests a dynamic and evolving universe. Therefore, the answer is C.
Answer: C","['Mercury_7015873', 'Mercury_7042683', 'Mercury_7084648', 'commonsenseqa_train_2045', 'commonsenseqa_train_8085']",True,C,744,66,810,1.4836149215698242,0.006128787994384766,1.489743709564209,2025-05-21T13:42:29.794653
combined,mmr,5,Mercury_401215,"Tides on Earth are mostly caused by the gravitational pull of
A. the Sun.
B. stars.
C. the Moon.
D. asteroids.",C,"This question is about the primary cause of tides on Earth. The first scientific principle is that tides are primarily caused by the gravitational pull of celestial bodies. The second thought process is that the Moon is much closer to Earth than the Sun, so its gravitational pull has a greater influence on tides. The third thought process is that while other celestial bodies have gravitational effects on Earth, the Moon's gravitational pull is the most significant factor in causing tides. Therefore, the answer is C. the Moon.
Answer: C. the Moon","['Mercury_SC_400039', 'NYSEDREGENTS_2009_8_12', 'commonsenseqa_train_3456', 'gsm8k_train_1022', 'Mercury_7239645']",True,C,792,108,900,1.1570677757263184,0.006278038024902344,1.1633458137512207,2025-05-21T13:42:31.726818
combined,mmr,5,Mercury_7248203,"Two species of garter snake in the genus Thamnophis originated from a single ancestor. These two species live in the same geographic area, however, one lives in arid land and the other lives in water.Which of the following best identifies the cause of speciation between these two garter snakes?
A. mechanical isolation
B. behavioral isolation
C. habitat isolation
D. allopatric isolation",C,"This question is about the mechanism of speciation between two closely related species living in the same geographic area but occupying different habitats. In this case, the speciation is likely due to habitat isolation, where the two species have adapted to different environments (arid land and water) within the same geographic area. This adaptation to different habitats leads to reproductive isolation and eventually speciation. Therefore, the answer is C. habitat isolation.
Answer: C","['commonsenseqa_train_6912', 'NYSEDREGENTS_2009_8_12', 'NYSEDREGENTS_2014_8_9', 'gsm8k_train_6615', 'Mercury_192290']",True,C,847,88,935,1.102039098739624,0.007116079330444336,1.1091551780700684,2025-05-21T13:42:33.416728
combined,mmr,5,OHAT_2009_5_42,"Which organism is a decomposer?
A. frog
B. worm
C. oak tree
D. grasshopper",B,"This question is about identifying a decomposer, which is an organism that breaks down dead organic matter. Among the options provided, the worm is the only organism that acts as a decomposer by breaking down dead organic material in the soil. Frogs, oak trees, and grasshoppers do not decompose dead matter. Therefore, the answer is B.
Answer: B","['Mercury_7188388', 'Mercury_SC_400165', 'Mercury_411450', 'commonsenseqa_train_4339', 'MCAS_1998_8_2']",True,B,753,74,827,1.1024551391601562,0.005993843078613281,1.1084489822387695,2025-05-21T13:42:35.135891
combined,mmr,5,NAEP_2005_8_S13+8,"Which is an example of water condensing? 1.
A. puddle disappearing on a hot summer afternoon
B. Sweat forming on your forehead after you do a lot of exercise
C. Ice cubes melting when you put them out in the sun
D. Dew forming on plants during a cold night",D,"This question is about the process of water condensing, which involves water vapor turning into liquid water. Option D, dew forming on plants during a cold night, is an example of water condensing as the water vapor in the air cools and forms liquid droplets on the plants. Therefore, the answer is D.
Answer: D","['VASoL_2007_3_13', 'gsm8k_train_4630', 'commonsenseqa_train_9485', 'commonsenseqa_train_7752', 'Mercury_SC_405024']",True,D,969,67,1036,1.0192031860351562,0.006028175354003906,1.0252313613891602,2025-05-21T13:42:36.914853
combined,mmr,5,AKDE&ED_2012_4_14,"Which process causes the fastest changes to the surface of Earth?
A. a large glacier forming on a mountain
B. strong winds wearing away a rock cliff
C. a major earthquake happening in a mountain range
D. many waves on a lake moving pebbles onto a beach",C,"This question is about the speed of surface changes caused by different natural processes. A major earthquake happening in a mountain range involves sudden and rapid movement of the Earth's crust, leading to immediate changes in the landscape. In contrast, the other options involve gradual processes that take longer to cause noticeable changes. Therefore, the answer is C.
Answer: C","['Mercury_SC_LBS10612', 'NYSEDREGENTS_2006_8_25', 'gsm8k_train_3063', 'NYSEDREGENTS_2006_8_11', 'Mercury_SC_400169']",True,C,969,69,1038,1.0304090976715088,0.008399724960327148,1.038808822631836,2025-05-21T13:42:38.718747
combined,mmr,5,Mercury_7027108,"Which event or principle cannot have its validity directly tested by laboratory experiment?
A. the Big Bang Theory
B. the Conservation of Energy
C. the Periodicity of Element Properties
D. the Acceleration of Objects due to Gravity",A,"This question is about scientific concepts that can or cannot be directly tested in a laboratory setting. The Big Bang Theory, the Conservation of Energy, and the Acceleration of Objects due to Gravity are all principles that can be tested through experiments in a controlled laboratory environment. However, the Periodicity of Element Properties, which refers to the repeating patterns of chemical and physical properties of elements in the periodic table, is a concept that is based on observations and trends rather than direct experimental testing in a laboratory. Therefore, the answer is C. the Periodicity of Element Properties.
Answer: C","['Mercury_7221795', 'commonsenseqa_train_3164', 'Mercury_7084648', 'gsm8k_train_938', 'Mercury_7098140']",False,C,949,115,1064,1.538228988647461,0.006134033203125,1.544363021850586,2025-05-21T13:42:40.872395
combined,mmr,5,MCAS_2000_4_10,"Irene needs to join two boards together. Which would NOT be used to join the boards together?
A. glue
B. screws
C. nails
D. saw",D,"This question is about joining two boards together using different methods. Glue, screws, and nails are all common methods of joining boards together. However, a saw is a tool used for cutting materials, not joining them together. Therefore, the answer is D. saw.
Answer: D. saw","['commonsenseqa_train_1654', 'gsm8k_train_7308', 'MCAS_2010_5_11983', 'Mercury_402570', 'commonsenseqa_train_158']",True,D,785,59,844,0.9348101615905762,0.006308794021606445,0.9411189556121826,2025-05-21T13:42:42.394535
combined,mmr,5,Mercury_405107,"A student has a mineral sample. He wonders if the sample is the mineral mica. He knows the cleavage pattern of mica is a smooth, flat sheet. The student can best find out the cleavage pattern of the sample by
A. shining a light on the mineral.
B. soaking the mineral in water.
C. rubbing a penny against the mineral.
D. breaking off a piece of the mineral.",D,"This question is about how to determine the cleavage pattern of a mineral sample. Cleavage refers to the way a mineral breaks along planes of weakness, resulting in smooth, flat surfaces. The best way to determine the cleavage pattern of a mineral sample is by breaking off a piece of the mineral. By breaking off a piece, the student can observe the natural cleavage surfaces and determine if they match the smooth, flat sheet characteristic of mica. Therefore, the answer is D.
Answer: D","['Mercury_7164798', 'gsm8k_train_6127', 'commonsenseqa_train_9485', 'gsm8k_train_4720', 'Mercury_411730']",True,D,978,100,1078,1.2418580055236816,0.007508993148803711,1.2493669986724854,2025-05-21T13:42:44.409418
combined,mmr,5,Mercury_SC_410837,"Researchers breed plants to produce crops that have helpful traits. One of these traits is the ability to grow where there is little moisture. How would this trait most likely benefit farmers?
A. It allows crops to be unaffected by disease.
B. It allows crops to be grown in drier climates.
C. It allows crops to survive without fertilization.
D. It allows crops to survive in areas with fewer seasons.",B,"This question is about the benefit of breeding plants with the ability to grow in low moisture conditions. Since the trait is specifically related to thriving in environments with little moisture, the most likely benefit to farmers would be the ability to grow crops in drier climates where water availability is limited. This trait does not directly relate to disease resistance, fertilization, or the number of seasons, so options A, C, and D are less relevant. Therefore, the answer is B. It allows crops to be grown in drier climates.
Answer: B","['Mercury_7141400', 'NYSEDREGENTS_2014_8_12', 'commonsenseqa_train_9485', 'commonsenseqa_train_1424', 'Mercury_7238980']",True,B,936,108,1044,1.1469917297363281,0.007073163986206055,1.1540648937225342,2025-05-21T13:42:46.178698
