dataset,method,num_examples,question_id,question,expected_answer,response,selected_examples,correct,extracted_answer,tokens_prompt_tokens,tokens_completion_tokens,tokens_total_tokens,response_time,selection_time,total_latency,timestamp
combined,mmr,5,AIMS_2008_8_12,"James placed a breath mint and a lump of toothpaste in a cup of water and let it sit overnight. Which statement best explains why the breath mint was gone the following morning, but the toothpaste was still at the bottom of the cup?
A. The breath mint was less soluble than the toothpaste.
B. The breath mint was more soluble than the toothpaste.
C. The breath mint had a lower density than the toothpaste.
D. The breath mint had a greater density than the toothpaste.",B,"This question is about the solubility of substances in water. Solubility refers to how well a substance dissolves in a solvent, in this case, water. The statement that best explains why the breath mint was gone the following morning is that the breath mint was more soluble than the toothpaste. This means that the breath mint dissolved completely in the water overnight, while the toothpaste, being less soluble, remained at the bottom of the cup. Therefore, the answer is B.
Answer: B","['AKDE&ED_2008_4_10', 'gsm8k_train_3268', 'VASoL_2008_3_26', 'NYSEDREGENTS_2006_8_37', 'Mercury_SC_415072']",True,B,808,101,909,1.588623285293579,0.007028341293334961,1.595651626586914,2025-05-21T13:42:48.526389
combined,mmr,5,Mercury_7216633,"Which of the following is the starting point for a new scientific investigation?
A. identifying experimental variables
B. forming a question that is the basis of a hypothesis
C. conducting repeated trials and graphing the data
D. writing out a procedure and collecting the needed equipment",B,"This question is about the initial steps in the scientific process. The starting point for a new scientific investigation is typically forming a question that serves as the basis for a hypothesis. This question guides the direction of the research and sets the stage for the experiment. Identifying experimental variables, conducting trials, and collecting equipment all come after the initial question has been formulated. Therefore, the answer is B. forming a question that is the basis of a hypothesis.
Answer: B. forming a question that is the basis of a hypothesis","['AKDE&ED_2008_4_41', 'ACTAAP_2008_7_14', 'commonsenseqa_train_2664', 'commonsenseqa_train_6548', 'gsm8k_train_556']",True,B,822,103,925,1.4782416820526123,0.00670170783996582,1.4849433898925781,2025-05-21T13:42:50.586387
combined,mmr,5,Mercury_406550,"Tapeworms live in the intestines of dogs and absorb nutrients from food the dog eats. Which best describes the outcome of this relationship?
A. The dog and tapeworm both become ill.
B. The dog becomes ill, and the tapeworm benefits.
C. The tapeworm and dog help each other survive.
D. The tapeworm helps the dog survive.",B,"This question is about symbiotic relationships, specifically parasitism. The first scientific principle is that parasitism involves one organism benefiting at the expense of another. The second thought process is that tapeworms absorb nutrients from the dog's food, depriving the dog of those nutrients and potentially causing illness. The third thought process is that the tapeworm benefits from the relationship by obtaining nutrients without providing any benefit to the dog. Therefore, the answer is B.
Answer: B","['Mercury_183138', 'Mercury_7214673', 'Mercury_7247835', 'gsm8k_train_6417', 'NYSEDREGENTS_2011_8_24']",True,B,982,97,1079,1.0900506973266602,0.0065958499908447266,1.0966465473175049,2025-05-21T13:42:52.302919
combined,mmr,5,Mercury_SC_402122,"Which of the following is a function of the digestive system of the human body?
A. carrying oxygen to the lungs
B. sending signals from the brain to the spinal cord
C. breaking down food into nutrients
D. providing support for the body",C,"This question is about the functions of the digestive system in the human body. The digestive system is responsible for breaking down food into nutrients that can be absorbed and used by the body. Therefore, the correct answer is C. breaking down food into nutrients.
Answer: C","['Mercury_7040863', 'gsm8k_train_1876', 'ACTAAP_2010_5_14', 'commonsenseqa_train_7749', 'Mercury_7200480']",True,C,775,53,828,1.158646821975708,0.00633692741394043,1.1649837493896484,2025-05-21T13:42:54.081557
combined,mmr,5,NYSEDREGENTS_2012_4_5,"Which terms are both used to describe the weather?
A. gravity and wind direction
B. precipitation and runoff
C. groundwater and erosion
D. air temperature and wind speed",D,"This question is about weather-related variables. Gravity and groundwater are not typically used to describe weather, so we can eliminate options A and C. Precipitation and runoff are related to water movement, but they are not direct descriptors of weather conditions. Air temperature and wind speed, on the other hand, are commonly used to describe weather as they provide information about the current state of the atmosphere. Therefore, the answer is D.
Answer: D","['NYSEDREGENTS_2011_4_3', 'NYSEDREGENTS_2006_8_25', 'gsm8k_train_1289', 'commonsenseqa_train_9740', 'Mercury_SC_400165']",True,D,774,88,862,1.8470797538757324,0.006228923797607422,1.8533086776733398,2025-05-21T13:42:56.549113
combined,mmr,5,Mercury_7142748,"When heat flows from a hot spot to a cooler spot, entropy increases. When heat is forced to flow from a cool spot to a warmer spot, entropy decreases. Marta is looking for something in her house that causes a decrease in entropy. Which of these should she choose?
A. an ice cube melting
B. the refrigerator
C. an egg frying
D. the toaster",B,"This question is about identifying a process that causes a decrease in entropy. Entropy is a measure of disorder or randomness in a system, and it tends to increase over time. When heat flows from a cool spot to a warmer spot, it goes against the natural direction of heat transfer, leading to a decrease in entropy. The only option that fits this description is the refrigerator, as it actively moves heat from the inside (cool spot) to the outside (warmer spot), causing a decrease in entropy. Therefore, the answer is B. the refrigerator.
Answer: B. the refrigerator","['MDSA_2008_5_40', 'commonsenseqa_train_3456', 'commonsenseqa_train_8379', 'commonsenseqa_train_7752', 'Mercury_7239645']",True,B,906,117,1023,1.3328652381896973,0.0065460205078125,1.3394112586975098,2025-05-21T13:42:58.505876
combined,mmr,5,Mercury_SC_408984,"In the 1600s a scientist named Anton van Leeuwenhoek worked toward improving microscopes and created his own lenses. With his microscopes, Leeuwenhoek discovered bacteria and muscle fibers. Which type of job benefited most from these discoveries?
A. glass making
B. astronomy
C. medicine
D. teaching",C,"This question is about the impact of Anton van Leeuwenhoek's discoveries on different fields. Leeuwenhoek's work in improving microscopes and discovering bacteria and muscle fibers laid the foundation for the field of microbiology. These discoveries revolutionized medicine by allowing scientists to study and understand microscopic organisms, leading to advancements in healthcare and disease treatment. Therefore, the field that benefited most from Leeuwenhoek's discoveries is medicine.
Answer: C. medicine","['commonsenseqa_train_409', 'NYSEDREGENTS_2006_8_37', 'Mercury_SC_408983', 'commonsenseqa_train_2296', 'gsm8k_train_1338']",True,C,935,94,1029,1.093278169631958,0.006653785705566406,1.0999319553375244,2025-05-21T13:43:00.384956
combined,mmr,5,NYSEDREGENTS_2015_8_28,"All living and nonliving material is composed of
1. air
2. elements
3. water
4. soil",2,"This question is about the basic building blocks of matter. All living and nonliving material is composed of elements, which are the simplest forms of matter that cannot be broken down further by chemical means. Elements combine to form compounds and substances, making them the fundamental components of all matter. Therefore, the answer is 2.
Answer: 2","['Mercury_7205538', 'AIMS_2009_4_9', 'gsm8k_train_4144', 'NYSEDREGENTS_2006_8_25', 'NYSEDREGENTS_2007_8_25']",True,B,767,68,835,1.453361988067627,0.009429216384887695,1.4627912044525146,2025-05-21T13:43:02.455557
combined,mmr,5,WASL_2005_5_10,"Sheri went on a field trip with her class and saw a stream with floating garbage. How could this pollution affect humans?
A. There may not be enough drinking water.
B. There may not be enough water in the water cycle.
C. There may not be enough oxygen for humans to breathe.",A,"This question is about the potential impacts of water pollution on humans. Floating garbage in a stream can lead to contamination of the water, making it unsafe for drinking. This pollution can also harm aquatic life, disrupt ecosystems, and potentially affect the availability of clean water for human consumption. Therefore, the answer is A.
Answer: A","['MDSA_2011_4_8', 'TIMSS_2003_4_pg27', 'NYSEDREGENTS_2006_8_25', 'Mercury_7239348', 'NYSEDREGENTS_2006_8_37']",True,A,732,65,797,1.085515022277832,0.006104946136474609,1.0916199684143066,2025-05-21T13:43:04.308694
combined,mmr,5,Mercury_7018393,"Sound travels as a
A. wave without a medium.
B. series of compressions only.
C. pattern of up and down vibrations.
D. pattern of compressions and rarefactions.",D,"This question is about the nature of sound waves and how they propagate. Sound waves are mechanical waves that require a medium to travel through, as they propagate through a series of compressions (high-pressure regions) and rarefactions (low-pressure regions). These compressions and rarefactions create a pattern of alternating high and low-pressure regions, which is characteristic of sound waves. Therefore, the answer is D.
Answer: D","['Mercury_7032550', 'AKDE&ED_2012_8_45', 'gsm8k_train_5066', 'Mercury_SC_400169', 'Mercury_7213150']",True,D,773,85,858,1.591620922088623,0.006323814392089844,1.597944736480713,2025-05-21T13:43:06.514350
combined,mmr,5,NYSEDREGENTS_2015_4_19,"During which process do animals increase in size?
A. breathing
B. growing
C. shedding
D. repairing",B,"This question is about the growth process in animals. Breathing, shedding, and repairing are not processes directly related to increasing in size. Growing is the process by which animals increase in size as they develop. Therefore, the answer is B.
Answer: B","['MCAS_2013_5_29398', 'Mercury_7084648', 'Mercury_SC_408983', 'MCAS_2002_5_12', 'gsm8k_train_2757']",True,B,914,51,965,0.8984458446502686,0.006865262985229492,0.905311107635498,2025-05-21T13:43:07.995404
combined,mmr,5,Mercury_7004795,"Which particles are responsible for the electric charge of an atom?
A. protons and neutrons
B. protons and electrons
C. neutrons and molecules
D. molecules and electrons",B,"This question is about the particles that contribute to the electric charge of an atom. Protons are positively charged particles found in the nucleus of an atom, while electrons are negatively charged particles that orbit the nucleus. Neutrons are neutral particles and do not contribute to the electric charge. Therefore, the electric charge of an atom is primarily determined by the balance between the number of protons (positive charge) and electrons (negative charge). The correct answer is B. protons and electrons.
Answer: B. protons and electrons","['Mercury_7008733', 'Mercury_SC_408983', 'Mercury_7165900', 'commonsenseqa_train_2144', 'gsm8k_train_3104']",True,B,695,105,800,1.4538159370422363,0.0062580108642578125,1.4600739479064941,2025-05-21T13:43:10.063696
combined,mmr,5,Mercury_SC_401838,"Which of these tools is most helpful to a scientist observing very small bacteria?
A. ruler
B. telescope
C. microscope
D. meter stick",C,"This question is about the tools used for observation in biology. Bacteria are very small organisms that cannot be seen with the naked eye. A microscope is specifically designed to magnify small objects, making it the most appropriate tool for observing very small bacteria. Therefore, the answer is C. microscope
Answer: C. microscope","['Mercury_SC_401145', 'NYSEDREGENTS_2006_8_37', 'MCAS_2005_8_35', 'Mercury_SC_LBS10908', 'commonsenseqa_train_9485']",True,C,706,64,770,1.0758259296417236,0.008512020111083984,1.0843379497528076,2025-05-21T13:43:11.850364
combined,mmr,5,Mercury_SC_402623,"What happens to sugar when it is combined with water?
A. it separates
B. it dissolves
C. it floats to the top
D. it becomes warm",B,"This question is about the behavior of sugar when mixed with water. When sugar is combined with water, it dissolves, meaning the sugar particles disperse evenly throughout the water without separating or floating to the top. This process is characteristic of a solution. Therefore, the answer is B. it dissolves.
Answer: B. it dissolves","['Mercury_SC_402081', 'gsm8k_train_17', 'commonsenseqa_train_9292', 'Mercury_7168648', 'commonsenseqa_train_3262']",True,B,891,68,959,0.9157838821411133,0.009504079818725586,0.9252879619598389,2025-05-21T13:43:13.387680
combined,mmr,5,MCAS_2010_5_13,"Which of the following must all plant and animal species do in order for each species to survive?
A. migrate
B. reproduce
C. make food
D. change color",B,"This question is about the essential process that all plant and animal species must do in order to survive. The first thought process is that migration is not a universal requirement for survival, as many species do not migrate. The second thought process is that changing color is also not essential for survival, as it is often a response to environmental factors rather than a necessity for survival. The third thought process is that making food is necessary for survival, but not all species directly make their own food. The fourth thought process is that reproduction is a fundamental process for the continuation of a species, ensuring the survival of the species through offspring. Therefore, the answer is reproduce.
Answer: B. reproduce","['Mercury_7056945', 'gsm8k_train_3268', 'ACTAAP_2010_5_14', 'commonsenseqa_train_2532', 'commonsenseqa_train_6735']",True,B,731,135,866,1.397655963897705,0.006303071975708008,1.403959035873413,2025-05-21T13:43:15.378819
combined,mmr,5,Mercury_402286,"Which characteristic do both the Moon and Earth share?
A. They both have rocky surfaces.
B. They both have active volcanoes.
C. They both have similar atmospheres.
D. They both have the same gravitational pull.",A,"This question is about the similarities between the Moon and Earth. Both the Moon and Earth have rocky surfaces, so A is a possible answer. However, the Moon does not have active volcanoes like Earth, so B is not correct. The Moon does not have a significant atmosphere like Earth, so C is also not correct. The Moon's gravitational pull is much weaker than Earth's, so D is not correct. Therefore, the only characteristic that both the Moon and Earth share is that they both have rocky surfaces. The answer is A.
Answer: A","['Mercury_SC_400039', 'NYSEDREGENTS_2009_8_12', 'Mercury_7097965', 'gsm8k_train_2569', 'Mercury_192290']",True,A,800,111,911,1.5359013080596924,0.006331205368041992,1.5422325134277344,2025-05-21T13:43:17.700205
combined,mmr,5,Mercury_7241255,"Neurons respond to stimuli and transmit impulses to coordinate body functions. Which of these indicates the rapid change in the membrane potential when a neuron is stimulated?
A. action potential
B. resting potential
C. refractory period
D. threshold period",A,"This question is about the electrical activity of neurons in response to stimuli. When a neuron is stimulated, a rapid change in membrane potential occurs, known as an action potential. This change in potential allows the neuron to transmit signals along its length. Resting potential refers to the baseline membrane potential of a neuron when it is not being stimulated. The refractory period is a brief period after an action potential when the neuron cannot generate another action potential. The threshold period is the level of depolarization required to trigger an action potential. Therefore, the answer is A.
Answer: A","['Mercury_7239488', 'gsm8k_train_465', 'Mercury_7084648', 'Mercury_7235655', 'Mercury_7098140']",True,A,837,115,952,1.4761700630187988,0.0067751407623291016,1.482945203781128,2025-05-21T13:43:19.766347
combined,mmr,5,Mercury_7263848,"Auroras occur where Earth's magnetosphere traps high-energy particles in which region of the atmosphere?
A. troposphere
B. stratosphere
C. thermosphere
D. exosphere",C,"This question is about the location of auroras in Earth's atmosphere. First, auroras are caused by high-energy particles from the Sun interacting with Earth's magnetosphere. Second, the magnetosphere traps these particles in the thermosphere, the outermost layer of Earth's atmosphere. Third, the troposphere and stratosphere are lower layers of the atmosphere where weather occurs, and the exosphere is the outermost layer beyond the thermosphere. Therefore, the answer is C. thermosphere.
Answer: C. thermosphere","['Mercury_SC_LBS10612', 'Mercury_7014420', 'gsm8k_train_1338', 'commonsenseqa_train_4345', 'commonsenseqa_train_1424']",True,C,928,105,1033,1.345654010772705,0.0066339969635009766,1.352288007736206,2025-05-21T13:43:21.736365
combined,mmr,5,ACTAAP_2010_7_8,"The list below gives some symptoms of people with the common cold. Symptoms of the Common Cold stuffy nose low fever sore throat cough Which body system is most affected by the common cold?
A. Nervous
B. Digestive
C. Circulatory
D. Respiratory",D,"This question is about the impact of the common cold on the body. The common cold primarily affects the respiratory system, as indicated by symptoms such as a stuffy nose, sore throat, and cough. These symptoms are related to the upper respiratory tract, including the nose, throat, and lungs. Therefore, the answer is D.
Answer: D","['Mercury_7071593', 'gsm8k_train_17', 'NYSEDREGENTS_2014_8_12', 'NCEOGA_2013_5_50', 'Mercury_SC_400053']",True,D,914,69,983,1.0639979839324951,0.006331920623779297,1.0703299045562744,2025-05-21T13:43:23.420103
combined,mmr,5,Mercury_7145583,"Elias investigates whether soaking beans in water before planting affects how the beans grow. Which beans would most likely be the control group?
A. the beans that were soaked the least amount of time
B. the beans that were not soaked in water
C. the beans that had the greatest mass
D. the beans that grew the tallest",B,"In this experiment, the control group should be the group that does not receive the treatment being tested, which in this case is soaking beans in water before planting. The control group allows for comparison to see the effect of the treatment. In this scenario, the beans that were not soaked in water would most likely be the control group as they did not receive the treatment of soaking. Therefore, the answer is B. the beans that were not soaked in water. 
Answer: B","['Mercury_7191590', 'commonsenseqa_train_9007', 'gsm8k_train_3307', 'commonsenseqa_train_8834', 'NYSEDREGENTS_2006_8_37']",True,B,942,95,1037,1.2092328071594238,0.006361961364746094,1.21559476852417,2025-05-21T13:43:25.222008
combined,mmr,5,NYSEDREGENTS_2015_4_16,"Which tool should a student use to examine spots on a frog?
A. thermometer
B. hand lens
C. graduated cylinder
D. magnet",B,"This question is about identifying the appropriate tool for examining spots on a frog. A thermometer is used to measure temperature, a graduated cylinder is used to measure volume, and a magnet is used to attract magnetic materials. A hand lens, on the other hand, is a magnifying glass that can be used to closely examine small details like spots on a frog. Therefore, the answer is B. hand lens.
Answer: B","['Mercury_SC_401368', 'gsm8k_train_6173', 'commonsenseqa_train_2925', 'Mercury_SC_400862', 'Mercury_411450']",True,B,777,84,861,1.6923401355743408,0.006010293960571289,1.698350429534912,2025-05-21T13:43:27.529943
combined,mmr,5,CSZ20334,"Gravity is responsible for the ___.
A. orbits of the planets around the Sun
B. rotation of a planet on its axis
C. tilt of Earth's axis
D. phases of the Moon",A,"This question is about the effects of gravity in the solar system. Gravity is the force that keeps planets in orbit around the Sun, so it is responsible for the orbits of the planets around the Sun. The rotation of a planet on its axis is caused by its initial angular momentum, the tilt of Earth's axis is due to gravitational interactions with other celestial bodies, and the phases of the Moon are caused by the relative positions of the Moon, Earth, and Sun. Therefore, the answer is A.
Answer: A","['Mercury_SC_400039', 'Mercury_7042823', 'gsm8k_train_5745', 'Mercury_7166163', 'Mercury_7097965']",True,A,723,103,826,1.5007789134979248,0.006200075149536133,1.506978988647461,2025-05-21T13:43:29.780748
combined,mmr,5,MCAS_1998_8_22,"A plant scientist is developing a new fertilizer called Hypergrow. She designs an experiment to test whether Hypergrow helps plants grow faster than Supergrow, a fertilizer already on the market. Which of the following should the scientist do with light during the experiment?
A. Apply the same amount of light to all the plants.
B. Apply only green light to all the plants.
C. Flash the lights to simulate a partly cloudy day.
D. Keep the plants in darkness.",A,"This question is about experimental controls in scientific investigations. To isolate the effect of the fertilizers being tested, the scientist should keep all other variables constant. Light is an important factor in plant growth, so the scientist should apply the same amount of light to all the plants to ensure that any differences in growth are due to the fertilizers and not the light conditions. Therefore, the answer is A. Apply the same amount of light to all the plants.
Answer: A. Apply the same amount of light to all the plants.","['Mercury_7191590', 'commonsenseqa_train_3456', 'gsm8k_train_2059', 'ACTAAP_2008_7_14', 'gsm8k_train_1338']",True,A,1028,105,1133,1.4737520217895508,0.008116960525512695,1.4818689823150635,2025-05-21T13:43:32.151605
combined,mmr,5,Mercury_7210455,"In which way is any single observation of wind speed best described?
A. It is an indication of a future weather condition.
B. It is an indication of the amount of humidity.
C. It is an indication of weather at a specific time.
D. It is an indication of the existing climate.",C,"This question is about the nature of wind speed observations. Wind speed is a variable that provides information about the current state of the atmosphere, specifically the movement of air molecules. It is not a predictor of future weather conditions or an indication of humidity levels. Instead, wind speed is a direct measurement of the weather at a specific time, reflecting the speed at which air is moving in the atmosphere. Therefore, the best description of any single observation of wind speed is that it is an indication of weather at a specific time. 
Answer: C","['NYSEDREGENTS_2011_4_3', 'gsm8k_train_4729', 'commonsenseqa_train_1200', 'NYSEDREGENTS_2006_8_37', 'Mercury_7069528']",True,C,799,107,906,1.8784449100494385,0.00643467903137207,1.8848795890808105,2025-05-21T13:43:34.627699
combined,mmr,5,Mercury_415081,"In a rubber duck race, the winning duck traveled 300 meters in 10 minutes. What was the duck's average speed?
A. 0.5 m/s
B. 1.0 m/s
C. 7.5 m/s
D. 30 m/s",A,"To calculate the average speed, we use the formula: speed = distance / time. In this case, the distance traveled by the winning duck is 300 meters, and the time taken is 10 minutes, which is equivalent to 600 seconds (10 minutes * 60 seconds/minute). 

Therefore, the average speed of the duck is 300 meters / 600 seconds = 0.5 meters per second. 

So, the answer is A. 0.5 m/s.","['Mercury_415080', 'Mercury_SC_413304', 'commonsenseqa_train_2085', 'VASoL_2009_3_10', 'gsm8k_train_4612']",True,A,817,100,917,1.4158053398132324,0.006436824798583984,1.4222421646118164,2025-05-21T13:43:36.668530
combined,mmr,5,Mercury_7008260,"Which is a possible consequence of global warming?
A. an increase in the amount of coral reefs
B. a decrease in temperature, causing earlier frosts
C. an increase in the number of heat waves, causing droughts
D. a decrease in temperature, causing shorter growing seasons",C,"This question is about the impacts of global warming on the environment. Global warming leads to changes in climate patterns, including an increase in extreme weather events. Heat waves are a common consequence of global warming, leading to droughts and other related issues. Therefore, the answer is C.
Answer: C","['LEAP__7_10350', 'gsm8k_train_1799', 'commonsenseqa_train_821', 'Mercury_7189805', 'NYSEDREGENTS_2009_8_12']",True,C,954,59,1013,0.9344260692596436,0.006579160690307617,0.9410052299499512,2025-05-21T13:43:38.190156
combined,mmr,5,Mercury_7137130,"The loudness of sound can be changed by
A. decreasing the pitch.
B. increasing the frequency.
C. increasing the amplitude.
D. decreasing the wavelength.",C,"This question is about the factors that affect the loudness of sound. The loudness of sound is determined by the amplitude of the sound wave. Increasing the amplitude of a sound wave makes it louder, while decreasing the amplitude makes it softer. Therefore, the answer is C.
Answer: C","['Mercury_SC_405129', 'Mercury_7017763', 'Mercury_402349', 'gsm8k_train_6423', 'Mercury_7136920']",True,C,772,58,830,1.282485008239746,0.006291866302490234,1.2887768745422363,2025-05-21T13:43:40.085097
