dataset,method,question_id,question,expected_answer,response,selected_examples,correct,extracted_answer,tokens_prompt_tokens,tokens_completion_tokens,tokens_total_tokens,response_time,selection_time,total_latency,timestamp
combined,cm-hdbscan-mmr,AIMS_2008_8_12,"James placed a breath mint and a lump of toothpaste in a cup of water and let it sit overnight. Which statement best explains why the breath mint was gone the following morning, but the toothpaste was still at the bottom of the cup?
A. The breath mint was less soluble than the toothpaste.
B. The breath mint was more soluble than the toothpaste.
C. The breath mint had a lower density than the toothpaste.
D. The breath mint had a greater density than the toothpaste.",B,"This question is about the solubility and density of the breath mint and toothpaste in water. Solubility refers to how well a substance dissolves in a solvent, in this case, water. If the breath mint was gone the following morning while the toothpaste remained at the bottom of the cup, it suggests that the breath mint dissolved in the water, while the toothpaste did not. This indicates that the breath mint was more soluble than the toothpaste. Density, on the other hand, refers to the mass of a substance per unit volume. The statement about density is not relevant to explaining why the breath mint dissolved and the toothpaste did not. Therefore, the answer is B. The breath mint was more soluble than the toothpaste.
Answer: B. The breath mint was more soluble than the toothpaste.","['AKDE&ED_2008_4_10', 'Mercury_SC_402081', 'Mercury_SC_401268', 'commonsenseqa_train_2085', 'commonsenseqa_train_6482']",True,B,874,166,1040,2.8735549449920654,0.0014691352844238281,2.8750240802764893,2025-05-17T19:19:34.692274
combined,cm-hdbscan-mmr,Mercury_7216633,"Which of the following is the starting point for a new scientific investigation?
A. identifying experimental variables
B. forming a question that is the basis of a hypothesis
C. conducting repeated trials and graphing the data
D. writing out a procedure and collecting the needed equipment",B,"This question is about the initial steps in the scientific process. The first step in a new scientific investigation is to form a question that will serve as the basis for a hypothesis. This question guides the direction of the investigation and helps focus the research. Identifying experimental variables, conducting trials, and collecting equipment all come after the initial question has been formulated. Therefore, the answer is B.
Answer: B","['AKDE&ED_2008_4_41', 'Mercury_SC_405506', 'Mercury_7006178', 'Mercury_7221795', 'Mercury_7082548']",True,B,798,80,878,1.9698412418365479,0.0016660690307617188,1.9715073108673096,2025-05-17T19:19:37.240421
combined,cm-hdbscan-mmr,Mercury_406550,"Tapeworms live in the intestines of dogs and absorb nutrients from food the dog eats. Which best describes the outcome of this relationship?
A. The dog and tapeworm both become ill.
B. The dog becomes ill, and the tapeworm benefits.
C. The tapeworm and dog help each other survive.
D. The tapeworm helps the dog survive.",B,"This question is about the relationship between tapeworms and dogs in terms of benefits and consequences. In this parasitic relationship, the tapeworm benefits by absorbing nutrients from the dog's food, while the dog may become ill or suffer from malnutrition due to the tapeworm's presence. Therefore, the best description of the outcome is B. The dog becomes ill, and the tapeworm benefits.
Answer: B","['Mercury_7056945', 'commonsenseqa_train_6596', 'commonsenseqa_train_8928', 'MDSA_2008_5_40', 'Mercury_7168683']",True,B,847,86,933,1.240910291671753,0.001542806625366211,1.2424530982971191,2025-05-17T19:19:39.100939
combined,cm-hdbscan-mmr,Mercury_SC_402122,"Which of the following is a function of the digestive system of the human body?
A. carrying oxygen to the lungs
B. sending signals from the brain to the spinal cord
C. breaking down food into nutrients
D. providing support for the body",C,"This question is about the functions of the digestive system. The digestive system is responsible for breaking down food into nutrients that can be absorbed and used by the body for energy, growth, and repair. Carrying oxygen to the lungs is a function of the circulatory system, sending signals from the brain to the spinal cord is a function of the nervous system, and providing support for the body is a function of the skeletal system. Therefore, the answer is C.
Answer: C","['Mercury_7040863', 'Mercury_7268223', 'Mercury_403701', 'MCAS_2003_8_34', 'NCEOGA_2013_5_15']",True,C,730,95,825,1.1269190311431885,0.0023958683013916016,1.12931489944458,2025-05-17T19:19:40.830752
combined,cm-hdbscan-mmr,NYSEDREGENTS_2012_4_5,"Which terms are both used to describe the weather?
A. gravity and wind direction
B. precipitation and runoff
C. groundwater and erosion
D. air temperature and wind speed",D,"This question is about the scientific concept of weather observation. Weather is typically described by variables that can be directly measured in the atmosphere, such as air temperature and wind speed. These observations provide immediate information about the current state of the atmosphere, which is essential for describing weather. Gravity, groundwater, and erosion are not typically used to describe weather conditions. Therefore, the answer is D. 
Answer: D","['NYSEDREGENTS_2011_4_3', 'MCAS_2016_5_11', 'NCEOGA_2013_5_8', 'VASoL_2009_3_17', 'ACTAAP_2010_7_4']",True,D,754,80,834,1.031851053237915,0.0014178752899169922,1.033268928527832,2025-05-17T19:19:42.478388
combined,cm-hdbscan-mmr,Mercury_7142748,"When heat flows from a hot spot to a cooler spot, entropy increases. When heat is forced to flow from a cool spot to a warmer spot, entropy decreases. Marta is looking for something in her house that causes a decrease in entropy. Which of these should she choose?
A. an ice cube melting
B. the refrigerator
C. an egg frying
D. the toaster",B,"This question is about the concept of entropy and the direction of heat flow. Entropy is a measure of disorder or randomness in a system, and it tends to increase over time. When heat flows from a hot spot to a cooler spot, entropy increases because the heat spreads out and becomes more disordered. On the other hand, when heat is forced to flow from a cool spot to a warmer spot, entropy decreases because the heat becomes more concentrated and ordered.

In this case, Marta is looking for something in her house that causes a decrease in entropy. Among the options provided, the refrigerator is the best choice. The refrigerator works by removing heat from its interior and expelling it outside, effectively forcing heat to flow from a cool spot (inside the refrigerator) to a warmer spot (outside the refrigerator). This process decreases the entropy inside the refrigerator, making it the correct choice.

Therefore, Marta should choose B. the refrigerator as the item in her house that causes a decrease in entropy.
Answer: B. the refrigerator","['MDSA_2008_5_40', 'commonsenseqa_train_4173', 'Mercury_SC_401191', 'Mercury_SC_410572', 'CSZ_2006_5_CSZ10266']",True,B,888,206,1094,2.4946670532226562,0.0017049312591552734,2.4963719844818115,2025-05-17T19:19:45.597525
combined,cm-hdbscan-mmr,Mercury_SC_408984,"In the 1600s a scientist named Anton van Leeuwenhoek worked toward improving microscopes and created his own lenses. With his microscopes, Leeuwenhoek discovered bacteria and muscle fibers. Which type of job benefited most from these discoveries?
A. glass making
B. astronomy
C. medicine
D. teaching",C,"This question is about the impact of Anton van Leeuwenhoek's discoveries on different fields. Leeuwenhoek's discovery of bacteria and muscle fibers using his improved microscopes had the most significant impact on the field of medicine. These discoveries revolutionized the understanding of the microscopic world and laid the foundation for the field of microbiology. Glass making, astronomy, and teaching were not directly impacted by these specific discoveries. Therefore, the answer is C. medicine.
Answer: C. medicine","['commonsenseqa_train_9446', 'Mercury_SC_401368', 'Mercury_7221795', 'Mercury_7171990', 'commonsenseqa_train_9295']",True,C,812,99,911,1.1098449230194092,0.0016171932220458984,1.111462116241455,2025-05-17T19:19:47.479373
combined,cm-hdbscan-mmr,NYSEDREGENTS_2015_8_28,"All living and nonliving material is composed of
1. air
2. elements
3. water
4. soil",2,"This question is about the composition of living and nonliving material. All matter, whether living or nonliving, is composed of elements. Elements are the basic building blocks of matter, and all substances are made up of combinations of different elements. While air, water, and soil are important components of the environment, they are not the fundamental building blocks of all material. Therefore, the answer is 2.
Answer: 2","['Mercury_7205538', 'TIMSS_2007_4_pg39', 'NYSEDREGENTS_2006_8_12', 'MCAS_2006_8_2', 'VASoL_2009_3_13']",True,B,655,85,740,1.0297729969024658,0.001483917236328125,1.031256914138794,2025-05-17T19:19:49.116748
combined,cm-hdbscan-mmr,WASL_2005_5_10,"Sheri went on a field trip with her class and saw a stream with floating garbage. How could this pollution affect humans?
A. There may not be enough drinking water.
B. There may not be enough water in the water cycle.
C. There may not be enough oxygen for humans to breathe.",A,"This question is about the potential impacts of water pollution on humans. The presence of floating garbage in a stream can contaminate the water, making it unsafe for drinking. This pollution can also harm aquatic life, affecting the overall health of the ecosystem. However, the pollution of a stream with floating garbage is unlikely to directly impact the amount of water in the water cycle or the availability of oxygen for humans to breathe. Therefore, the most immediate concern would be the availability of clean drinking water. Therefore, the answer is A.
Answer: A","['Mercury_183733', 'MCAS_2016_5_11', 'MSA_2012_5_31', 'Mercury_7215635', 'Mercury_SC_401364']",True,A,751,108,859,1.3732459545135498,0.0017600059509277344,1.3750059604644775,2025-05-17T19:19:51.268598
combined,cm-hdbscan-mmr,Mercury_7018393,"Sound travels as a
A. wave without a medium.
B. series of compressions only.
C. pattern of up and down vibrations.
D. pattern of compressions and rarefactions.",D,"This question is about the nature of sound waves and how they travel. Sound waves are mechanical waves that require a medium to travel through, such as air, water, or solids. Sound waves consist of compressions (areas of high pressure) and rarefactions (areas of low pressure) that propagate through the medium. Therefore, the answer is D. pattern of compressions and rarefactions.
Answer: D","['MCAS_2009_5_6522', 'CSZ20827', 'commonsenseqa_train_7461', 'MCAS_2003_5_31', 'Mercury_7239488']",True,D,703,83,786,1.0303051471710205,0.0015060901641845703,1.031811237335205,2025-05-17T19:19:52.908320
combined,cm-hdbscan-mmr,NYSEDREGENTS_2015_4_19,"During which process do animals increase in size?
A. breathing
B. growing
C. shedding
D. repairing",B,"This question is about the process of growth in animals. Breathing, shedding, and repairing are all physiological processes that do not necessarily involve an increase in size. Growing, on the other hand, is the process by which animals increase in size as they develop and mature. Therefore, the answer is B.
Answer: B","['Mercury_SC_400863', 'MCAS_2016_5_12', 'MCAS_2016_5_7', 'MCAS_2013_5_29398', 'Mercury_SC_401220']",True,B,741,64,805,0.9677910804748535,9.679794311523438e-05,0.9678878784179688,2025-05-17T19:19:54.442148
combined,cm-hdbscan-mmr,Mercury_7004795,"Which particles are responsible for the electric charge of an atom?
A. protons and neutrons
B. protons and electrons
C. neutrons and molecules
D. molecules and electrons",B,"This question is about the subatomic particles that carry electric charge. Protons and electrons are the particles responsible for the electric charge of an atom. Protons have a positive charge, while electrons have a negative charge. Neutrons are neutral and do not contribute to the overall charge of the atom. Molecules are groups of atoms bonded together and do not carry individual charges. Therefore, the correct answer is B, protons and electrons.
Answer: B","['Mercury_7008733', 'Mercury_7132003', 'Mercury_7009503', 'Mercury_7213448', 'MCAS_2009_5_6522']",True,B,663,91,754,1.1132957935333252,0.0016319751739501953,1.1149277687072754,2025-05-17T19:19:56.187306
combined,cm-hdbscan-mmr,Mercury_SC_401838,"Which of these tools is most helpful to a scientist observing very small bacteria?
A. ruler
B. telescope
C. microscope
D. meter stick",C,"This question is about the appropriate tool for observing very small bacteria. Bacteria are microscopic organisms that cannot be seen with the naked eye. A microscope is specifically designed to magnify objects that are too small to be seen clearly by the human eye, making it the most helpful tool for observing very small bacteria. A ruler, telescope, and meter stick are not designed for observing microscopic organisms. Therefore, the answer is C. 
Answer: C","['Mercury_7006178', 'Mercury_SC_405793', 'Mercury_SC_401368', 'NYSEDREGENTS_2004_4_28', 'Mercury_178903']",True,C,701,88,789,1.3272383213043213,0.002167224884033203,1.3294055461883545,2025-05-17T19:19:58.136267
combined,cm-hdbscan-mmr,Mercury_SC_402623,"What happens to sugar when it is combined with water?
A. it separates
B. it dissolves
C. it floats to the top
D. it becomes warm",B,"This question is about the interaction between sugar and water. When sugar is combined with water, it dissolves, meaning the sugar molecules disperse and mix uniformly with the water molecules. This results in a homogeneous mixture where the sugar particles are evenly distributed throughout the water. Therefore, the answer is B.
Answer: B","['Mercury_SC_402081', 'Mercury_SC_413300', 'CSZ_2007_5_CSZ20560', 'commonsenseqa_train_1604', 'Mercury_7168683']",True,B,745,63,808,1.4851107597351074,0.0018951892852783203,1.4870059490203857,2025-05-17T19:20:00.281829
combined,cm-hdbscan-mmr,MCAS_2010_5_13,"Which of the following must all plant and animal species do in order for each species to survive?
A. migrate
B. reproduce
C. make food
D. change color",B,"This question is about the essential process that all plant and animal species must engage in to ensure their survival. Reproduction is a fundamental biological process that allows species to pass on their genetic information to the next generation. Without reproduction, a species would not be able to continue its existence over time. Migration, making food, and changing color are not universally required for all species to survive. Therefore, the answer is B.
Answer: B","['Mercury_7056945', 'Mercury_SC_LBS10472', 'MCAS_2016_5_9', 'Mercury_7137673', 'Mercury_7074865']",True,B,758,86,844,1.257354974746704,0.0015668869018554688,1.2589218616485596,2025-05-17T19:20:02.124035
combined,cm-hdbscan-mmr,Mercury_402286,"Which characteristic do both the Moon and Earth share?
A. They both have rocky surfaces.
B. They both have active volcanoes.
C. They both have similar atmospheres.
D. They both have the same gravitational pull.",A,"This question is about similarities between the Moon and Earth. Both the Moon and Earth have rocky surfaces, so option A is a valid characteristic they share. The Moon does not have active volcanoes like Earth, so option B is incorrect. The Moon has a very thin atmosphere compared to Earth, so option C is not accurate. While both the Moon and Earth exert gravitational pull, the strength of their gravitational forces is different due to their mass differences. Therefore, the most accurate characteristic they share is having rocky surfaces, making the answer A.
Answer: A","['Mercury_SC_400039', 'Mercury_7205538', 'Mercury_7004515', 'Mercury_7017080', 'Mercury_182613']",True,A,702,110,812,1.1995079517364502,0.001566171646118164,1.2010741233825684,2025-05-17T19:20:04.092527
combined,cm-hdbscan-mmr,Mercury_7241255,"Neurons respond to stimuli and transmit impulses to coordinate body functions. Which of these indicates the rapid change in the membrane potential when a neuron is stimulated?
A. action potential
B. resting potential
C. refractory period
D. threshold period",A,"This question is about the electrical activity of neurons in response to stimuli. When a neuron is stimulated, a rapid change in membrane potential occurs, known as an action potential. This change in electrical charge allows the neuron to transmit signals along its length. Therefore, the answer is A.
Answer: A","['Mercury_7239488', 'Mercury_SC_415014', 'Mercury_SC_400155', 'Mercury_7029698', 'Mercury_7171990']",True,A,689,59,748,1.194700002670288,0.005515098571777344,1.2002151012420654,2025-05-17T19:20:06.094503
combined,cm-hdbscan-mmr,Mercury_7263848,"Auroras occur where Earth's magnetosphere traps high-energy particles in which region of the atmosphere?
A. troposphere
B. stratosphere
C. thermosphere
D. exosphere",C,"This question is about the location of auroras and the interaction with Earth's magnetosphere. Auroras are caused by high-energy particles from the Sun interacting with Earth's magnetosphere and entering the atmosphere near the poles. These particles are trapped and guided by Earth's magnetic field to the region of the atmosphere known as the thermosphere. Therefore, the answer is C.
Answer: C","['Mercury_SC_LBS10612', 'Mercury_7132003', 'commonsenseqa_train_6790', 'MCAS_2005_8_35', 'Mercury_7165900']",True,C,742,76,818,1.1424570083618164,0.0016901493072509766,1.1441471576690674,2025-05-17T19:20:07.853285
combined,cm-hdbscan-mmr,ACTAAP_2010_7_8,"The list below gives some symptoms of people with the common cold. Symptoms of the Common Cold stuffy nose low fever sore throat cough Which body system is most affected by the common cold?
A. Nervous
B. Digestive
C. Circulatory
D. Respiratory",D,"This question is about identifying the body system most affected by the common cold based on the symptoms provided. The common cold primarily affects the respiratory system, as indicated by symptoms such as a stuffy nose, sore throat, and cough. These symptoms are related to the upper respiratory tract infection caused by viruses. Therefore, the answer is D.
Answer: D","['Mercury_7040863', 'Mercury_180163', 'commonsenseqa_train_3652', 'ACTAAP_2010_7_4', 'Mercury_7041825']",True,D,753,70,823,1.0670790672302246,0.0014348030090332031,1.0685138702392578,2025-05-17T19:20:09.534515
combined,cm-hdbscan-mmr,Mercury_7145583,"Elias investigates whether soaking beans in water before planting affects how the beans grow. Which beans would most likely be the control group?
A. the beans that were soaked the least amount of time
B. the beans that were not soaked in water
C. the beans that had the greatest mass
D. the beans that grew the tallest",B,"This question is about experimental controls in scientific investigations. In this case, the control group should represent the standard condition against which the experimental group (soaked beans) is compared. The control group should not receive the treatment being tested, which in this case is soaking in water. Therefore, the beans that were not soaked in water (option B) would most likely be the control group in this investigation.
Answer: B","['Mercury_7191590', 'commonsenseqa_train_5947', 'Mercury_SC_405506', 'Mercury_7141400', 'Mercury_178903']",True,B,858,83,941,1.1199932098388672,0.0017330646514892578,1.1217262744903564,2025-05-17T19:20:11.249947
combined,cm-hdbscan-mmr,NYSEDREGENTS_2015_4_16,"Which tool should a student use to examine spots on a frog?
A. thermometer
B. hand lens
C. graduated cylinder
D. magnet",B,"This question is about identifying the appropriate tool for examining spots on a frog. A hand lens is a magnifying glass that allows for close inspection of small details, making it the best choice for examining spots on a frog. Thermometers measure temperature, graduated cylinders measure volume, and magnets attract certain materials but are not suitable for examining spots on a frog. Therefore, the answer is B.
Answer: B","['Mercury_SC_401368', 'NYSEDREGENTS_2004_4_28', 'Mercury_SC_401645', 'Mercury_7006178', 'AKDE&ED_2008_4_41']",True,B,692,80,772,1.197869062423706,0.0023980140686035156,1.2002670764923096,2025-05-17T19:20:13.165343
combined,cm-hdbscan-mmr,CSZ20334,"Gravity is responsible for the ___.
A. orbits of the planets around the Sun
B. rotation of a planet on its axis
C. tilt of Earth's axis
D. phases of the Moon",A,"This question is about the effects of gravity in the solar system. Gravity is the force that keeps planets in orbit around the Sun, so it is responsible for the orbits of the planets around the Sun. Therefore, the answer is A. 
Answer: A","['Mercury_SC_400039', 'VASoL_2010_5_25', 'Mercury_SC_406744', 'Mercury_7179953', 'Mercury_7146090']",True,A,745,51,796,0.90476393699646,0.0015108585357666016,0.9062747955322266,2025-05-17T19:20:14.839401
combined,cm-hdbscan-mmr,MCAS_1998_8_22,"A plant scientist is developing a new fertilizer called Hypergrow. She designs an experiment to test whether Hypergrow helps plants grow faster than Supergrow, a fertilizer already on the market. Which of the following should the scientist do with light during the experiment?
A. Apply the same amount of light to all the plants.
B. Apply only green light to all the plants.
C. Flash the lights to simulate a partly cloudy day.
D. Keep the plants in darkness.",A,"This question is about controlling variables in a scientific experiment. In this case, the scientist is testing the effect of the new fertilizer on plant growth. To isolate the impact of the fertilizers, the scientist should keep all other variables constant. Light is an important factor in plant growth, so the scientist should apply the same amount of light to all the plants to ensure that any differences in growth are due to the fertilizers and not the light conditions. Therefore, the answer is A.
Answer: A","['Mercury_7191590', 'Mercury_SC_405506', 'commonsenseqa_train_3598', 'NYSEDREGENTS_2009_4_28', 'Mercury_7032813']",True,A,812,99,911,1.0917470455169678,0.0016450881958007812,1.0933921337127686,2025-05-17T19:20:16.682156
combined,cm-hdbscan-mmr,Mercury_7210455,"In which way is any single observation of wind speed best described?
A. It is an indication of a future weather condition.
B. It is an indication of the amount of humidity.
C. It is an indication of weather at a specific time.
D. It is an indication of the existing climate.",C,"This question is about the nature of wind speed observations. Wind speed is a direct measurement of the movement of air at a specific time, providing information about the current weather conditions. It is not necessarily a predictor of future weather conditions, an indicator of humidity levels, or reflective of the existing climate, which is a long-term pattern. Therefore, the answer is C. 
Answer: C","['NYSEDREGENTS_2011_4_3', 'NCEOGA_2013_5_8', 'MCAS_2016_5_11', 'ACTAAP_2010_7_4', 'Mercury_SC_414016']",True,C,792,77,869,0.9640257358551025,0.00167083740234375,0.9656965732574463,2025-05-17T19:20:18.226956
combined,cm-hdbscan-mmr,Mercury_415081,"In a rubber duck race, the winning duck traveled 300 meters in 10 minutes. What was the duck's average speed?
A. 0.5 m/s
B. 1.0 m/s
C. 7.5 m/s
D. 30 m/s",A,"To find the average speed, we divide the total distance by the total time taken. The duck traveled 300 meters in 10 minutes, which is 300/10 = 30 meters per minute. To convert this to meters per second, we divide by 60 (since there are 60 seconds in a minute), so 30/60 = 0.5 meters per second. Therefore, the answer is A. 

Answer: A","['Mercury_415080', 'gsm8k_train_1875', 'gsm8k_train_7417', 'gsm8k_train_244', 'gsm8k_train_4945']",True,A,852,90,942,1.4128661155700684,0.0016961097717285156,1.4145622253417969,2025-05-17T19:20:20.251111
combined,cm-hdbscan-mmr,Mercury_7008260,"Which is a possible consequence of global warming?
A. an increase in the amount of coral reefs
B. a decrease in temperature, causing earlier frosts
C. an increase in the number of heat waves, causing droughts
D. a decrease in temperature, causing shorter growing seasons",C,"This question is about the impacts of global warming on climate patterns. Global warming leads to higher overall temperatures, which can result in more frequent and intense heat waves, leading to drought conditions. This can have severe consequences on agriculture, water availability, and ecosystems. Therefore, the answer is C. 
Answer: C","['LEAP__7_10350', 'Mercury_7215635', 'Mercury_SC_417575', 'MEA_2010_8_16-v1', 'Mercury_7026583']",True,C,784,62,846,0.9501512050628662,0.001657247543334961,0.9518084526062012,2025-05-17T19:20:21.787853
combined,cm-hdbscan-mmr,Mercury_7137130,"The loudness of sound can be changed by
A. decreasing the pitch.
B. increasing the frequency.
C. increasing the amplitude.
D. decreasing the wavelength.",C,"This question is about the factors that affect the loudness of sound. The loudness of sound is determined by the amplitude of the sound wave, which corresponds to the intensity or energy of the sound. Therefore, increasing the amplitude of the sound wave will result in a louder sound. Therefore, the answer is C. increasing the amplitude.
Answer: C","['Mercury_SC_415014', 'Mercury_7239488', 'Mercury_7009503', 'commonsenseqa_train_7461', 'Mercury_SC_413300']",True,C,698,70,768,1.11564302444458,0.0014960765838623047,1.1171391010284424,2025-05-17T19:20:23.524869
